Name;Full Price;Current Price;Quantity;Category;Subcategory
Mortadella Bologna Igp con Pistacchio;1,49;0,99;120 g;Salumi e Formaggi;Mortadella
Mortadella Bologna Igp;1,49;1,19;150 g;Salumi e Formaggi;Mortadella
Mortadella a Fette Tradizione Italiana;;0,79;150 g;Salumi e Formaggi;Mortadella
Citterio Sofficette Prosciutto cotto di alta quali...;1,79;1,16;80 g;Salumi e Formaggi;Prosciutto cotto
Fratelli Beretta le Meraviglie d'Italia Prosciutto...;4,69;1,75;120 g;Salumi e Formaggi;Prosciutto cotto
Citterio Bio Prosciutto cotto di alta qualità;3,82;1,69;110 g;Salumi e Formaggi;Prosciutto cotto
Parmacotto, prosciutto cotto di Alta Qualità a fet...;4,24;1,69;100 g;Salumi e Formaggi;Prosciutto cotto
PROSCIUTTO COTTO NOSTRALE;4,99;2,08;100 g;Salumi e Formaggi;Prosciutto cotto
PROSCIUTTO COTTO;2,99;1,79;80 g;Salumi e Formaggi;Prosciutto cotto
PROSCIUTTO COTTO;12,00;1,55;110 g;Salumi e Formaggi;Prosciutto cotto
Rovagnati i Firmati Prosciutto Cotto di Alta Quali...;4,15;3,32;100 g;Salumi e Formaggi;Prosciutto cotto
Cipressi in Chianti Prosciutto arrosto;5,49;4,89;100 g;Salumi e Formaggi;Prosciutto cotto
Negroni, gran cotto a fette;5,98;3,34;110 g;Salumi e Formaggi;Prosciutto cotto
Prosciutto Cotto Di Alta Qualità;3,45;2,00;150 g;Salumi e Formaggi;Prosciutto cotto
Prosciutto Cotto Di Alta Qualità;4,49;3,69;140 g;Salumi e Formaggi;Prosciutto cotto
Prosciutto Cotto Di Alta Qualità;2,58;1,95;130 g;Salumi e Formaggi;Prosciutto cotto
Prosciutto Cotto Toast 8 Fette;1,75;1,55;100 g;Salumi e Formaggi;Prosciutto cotto
PROSCIUTTO COTTO SCELTO;1,49;1,19;150 g;Salumi e Formaggi;Prosciutto cotto
PROSCIUTTO COTTO NOSTRANO;45,60;6,00;160;Salumi e Formaggi;Prosciutto cotto
PROSCIUTTO COTTO;2,99;1,69;140 g;Salumi e Formaggi;Prosciutto cotto
Rosa dell'Angelo, prosciutto cotto nostrano a fett...;53,90;5,68;;Salumi e Formaggi;Prosciutto cotto
PROSCIUTTO COTTO;4,99;2,09;125 g;Salumi e Formaggi;Prosciutto cotto
Prosciutto Cotto Alta Qualità;2,30;1,75;110 g;Salumi e Formaggi;Prosciutto cotto
Prosciutto Cotto Alta Qualità;2,50;1,69;150 g;Salumi e Formaggi;Prosciutto cotto
Prosciutto Cotto Di Alta Qualità;3,49;0,89;120 g;Salumi e Formaggi;Prosciutto cotto
PROSCIUTTO COTTO;2,89;1,35;90 g;Salumi e Formaggi;Prosciutto cotto
PROSCIUTTO COTTO ALTA QUALITA';3,19;1,79;120 g;Salumi e Formaggi;Prosciutto cotto
PROSCIUTTO COTTO;1,39;1,29;80 g;Salumi e Formaggi;Prosciutto cotto
PROSCIUTTO COTTO;17,90;8,00;100;Salumi e Formaggi;Prosciutto cotto
Citterio Bio Prosciutto Crudo;4,99;1,69;80 g;Salumi e Formaggi;Prosciutto cotto
NEGRONI Prosciutto cotto Alta Qualità;1,85;0,69;110 g;Salumi e Formaggi;Prosciutto cotto
COTTO I LOVE YOU;4,19;2,93;110 g;Salumi e Formaggi;Prosciutto cotto
Negroni, Cotto Stella prosciutto cotto alta qualit...;9,98;4,49;300 g;Salumi e Formaggi;Prosciutto cotto
100per100 Carne Italiana Fiordicotto;;2,59;90 g;Salumi e Formaggi;Prosciutto cotto
Parmacotto, prosciutto cotto di Alta Qualità a fet...;6,98;3,49;200 g;Salumi e Formaggi;Prosciutto cotto
Prosciutto Cotto Alta Qualità;15,00;1,65;100 g;Salumi e Formaggi;Prosciutto crudo
Citterio - Sofficette Petto di Tacchino al Forno;1,89;1,19;80 g;Salumi e Formaggi;Prosciutto crudo
Fratelli Beretta La Fresca Salumeria Prosciutto cr...;3,69;2,99;100 g;Salumi e Formaggi;Prosciutto crudo
Citterio - Sofficette di Prosciutto Crudo;1,79;1,00;60 g;Salumi e Formaggi;Prosciutto crudo
SALAME FELINO;3,79;1,70;90 g;Salumi e Formaggi;Prosciutto crudo
PROSCIUTTO DI PARMA;22,90;2,00;100;Salumi e Formaggi;Prosciutto crudo
Citterio Tagliofresco il Salame di Milano l'Origin...;2,26;0,99;70 g;Salumi e Formaggi;Prosciutto crudo
Rovagnati i Firmati Prosciutto Crudo Stagionato;3,99;2,99;100 g;Salumi e Formaggi;Prosciutto crudo
NEGRONI Cubetti di cotto;2,85;1,30;120 g;Salumi e Formaggi;Prosciutto crudo
Casa Modena Teneroni Prosciutto Cotto di Alta Qual...;3,49;1,79;100 g;Salumi e Formaggi;Prosciutto crudo
Citterio la Merenda Prosciutto Cotto di Alta Quali...;1,09;0,81;40 g;Salumi e Formaggi;Prosciutto crudo
Rovagnati Snello Prosciutto Crudo Stagionato;2,89;1,85;70 g;Salumi e Formaggi;Prosciutto crudo
Rovagnati Snello Arrosto di Tacchino;2,25;1,35;110 g;Salumi e Formaggi;Prosciutto crudo
Casa Modena, LiberaMente mortadella di pollo a fet...;1,89;1,32;110 g;Salumi e Formaggi;Prosciutto crudo
Aia aeQuilibrium Bresaola di Tacchino;3,51;1,44;100 g;Salumi e Formaggi;Prosciutto crudo
Fratelli Beretta Bacon fette;3,59;2,19;100 g;Salumi e Formaggi;Prosciutto crudo
Ferrarini Prosciutto cotto di alta qualità;4,59;2,69;120 g;Salumi e Formaggi;Prosciutto crudo
Rovagnati Snello Prosciutto cotto;24,90;1,55;110 g;Salumi e Formaggi;Prosciutto crudo
Negroni Prosciutto crudo;4,07;2,00;100 g;Salumi e Formaggi;Prosciutto crudo
PROSCIUTTO CRUDO;15,90;1,00;100;Salumi e Formaggi;Prosciutto crudo
PROSCIUTTO CRUDO;4,19;2,39;80 g;Salumi e Formaggi;Prosciutto crudo
PROSCIUTTO CRUDO;19,00;2,67;120 g;Salumi e Formaggi;Prosciutto crudo
PROSCIUTTO CRUDO;4,47;2,89;110 g;Salumi e Formaggi;Prosciutto crudo
PROSCIUTTO CRUDO;15,00;1,79;100 g;Salumi e Formaggi;Prosciutto crudo
Fratelli Beretta Prosciutto Cotto per Toast;4,38;2,52;400 g;Salumi e Formaggi;Prosciutto crudo
Negroni Pancetta Affumicata in Cubetti;3,60;2,99;200 g;Salumi e Formaggi;Prosciutto crudo
Rovagnati Snello Prosciutto Crudo Stagionato;3,39;2,29;0,70 Kg;Salumi e Formaggi;Prosciutto crudo
Citterio la Merenda Prosciutto Crudo 5 fette;1,00;0,79;30 g;Salumi e Formaggi;Prosciutto crudo
Rovagnati Snello Arrosto di Pollo alle Erbe Fini;2,99;1,79;110 g;Salumi e Formaggi;Prosciutto crudo
Fratelli Beretta Fresca Salumeria Tacchino al Forn...;3,32;1,99;130 g;Salumi e Formaggi;Prosciutto crudo
Casa Modena LiberaMente Prosciutto Cotto di Alta Q...;2,89;1,73;110 g;Salumi e Formaggi;Prosciutto crudo
Masina Sapore Salute Hamburger di Equino Classico;2,99;2,39;0,200 Kg;Salumi e Formaggi;Prosciutto crudo
Citterio - Sofficette l'originale Salame di Milano;2,19;1,35;60 g;Salumi e Formaggi;Salame
Negronetto;5,51;3,90;220 g;Salumi e Formaggi;Salame
Salame Tipo Milano Da Suini Italiani;2,09;1,67;90 g;Salumi e Formaggi;Salame
MORTADELLA;3,89;0,99;150 g;Salumi e Formaggi;Salame
MORTADELLA CALIBRATA;5,50;2,99;500 g;Salumi e Formaggi;Salame
SALAME MILANO;2,60;2,21;120 g;Salumi e Formaggi;Salame
Levoni, salame ungherese a fette;4,69;1,99;100 g;Salumi e Formaggi;Salame
Snello Arrosto di Tacchino;2,99;1,69;105 g;Salumi e Formaggi;Salame
SALAME VENTRICINA;2,49;1,99;100;Salumi e Formaggi;Salame
Mortadella Da Suini Italiani;3,95;2,96;500 g;Salumi e Formaggi;Salame
Salame Campagnolo Da Suini Italiani;2,09;1,99;100 g;Salumi e Formaggi;Salame
Salame Tipo Ungherese Da Suini Italiani;2,45;1,83;100 g;Salumi e Formaggi;Salame
Prosciutto Cotto Di Alta Qualità;7,49;5,95;500 g;Salumi e Formaggi;Salame
Salsiccia Passita;3,95;1,99;500 g;Salumi e Formaggi;Salame
SALAMETTO SETTENANI;15,99;0,27;340;Salumi e Formaggi;Salame
SALAME FELINO IGP;22,90;3,87;600;Salumi e Formaggi;Salame
SALAME MILANO;1,29;1,19;120 g;Salumi e Formaggi;Salame
SALAMINI CLASSICI;1,85;1,00;85 g;Salumi e Formaggi;Salame
STICK MINIMINI CLASSICI;2,39;1,55;60 g;Salumi e Formaggi;Salame
Negroni Salame Milano;4,71;1,84;100 g;Salumi e Formaggi;Salame
Citterio - Citterino Riassunto;1,79;1,00;60 g;Salumi e Formaggi;Salame
NEGRONI Salame Negronetto;2,42;1,79;75 g;Salumi e Formaggi;Salame
Gran Goloso Salame Rustico;2,55;1,99;80 g;Salumi e Formaggi;Salame
Salame al Tartufo;4,90;1,99;100 g;Salumi e Formaggi;Salame
Snello Prosciutto Cotto 0,500 Kg;8,75;7,85;500 g;Salumi e Formaggi;Salame
Negronetto Salame;5,63;4,50;200 g;Salumi e Formaggi;Salame
Aequilibrium Salame con Tacchino;2,43;2,29;80 g;Salumi e Formaggi;Salame
Artigiani Di Bottega Salame Al Peperoncino Rosso;3,45;1,00;100 g;Salumi e Formaggi;Salame
GALBANETTO IL TRADIZIONALE;17,90;6,56;230;Salumi e Formaggi;Salame
MORTADELLA DI POLLO;1,20;0,90;110 g;Salumi e Formaggi;Salame
SALAME MILANO;1,39;1,30;100 g;Salumi e Formaggi;Salame
Terre Ducali, mini Strolghino di culatello;3,99;2,89;120 g;Salumi e Formaggi;Salame
Mortadella Bologna IGP con pistacchio;2,39;1,43;110 g;Salumi e Formaggi;Salumi da Banco
MORTADELLA;2,79;0,79;150 g;Salumi e Formaggi;Salumi da Banco
Prosciutto di Parma DOP;27,00;2,99;100 g;Salumi e Formaggi;Salumi da Banco
Prosciutto Toscano DOP;21,90;2,40;100 g;Salumi e Formaggi;Salumi da Banco
PROSCIUTTO CRUDO STAGIONATO;5,00;3,29;100 g;Salumi e Formaggi;Salumi da Banco
SALAME MILANO;19,90;1,99;100;Salumi e Formaggi;Salumi da Banco
PANCETTA COPPATA;14,00;1,85;100 g;Salumi e Formaggi;Salumi da Banco
MORTADELLA DI FEGATO COTTA;1,99;1,03;100 g;Salumi e Formaggi;Salumi da Banco
PANCETTA;2,29;1,09;100 g;Salumi e Formaggi;Salumi da Banco
PROSCIUTTO CRUDO;17,90;1,98;100 g;Salumi e Formaggi;Salumi da Banco
MORTADELLA BOLOGNA CON;10,90;0,89;100;Salumi e Formaggi;Salumi da Banco
PROSCIUTTO COTTO;21,90;2,07;100;Salumi e Formaggi;Salumi da Banco
Speck Alto Adige IGP;14,00;3,89;100 g;Salumi e Formaggi;Salumi da Banco
Salame Cotto;9,90;1,29;100;Salumi e Formaggi;Salumi da Banco
Guanciale;5,09;1,30;100 g;Salumi e Formaggi;Salumi da Banco
Speck Gran Resa Igp;2,45;1,59;100 g;Salumi e Formaggi;Salumi da Banco
E Brie;1,39;1,35;200 g;Salumi e Formaggi;Salumi da Banco
PANCETTA;35,60;5,57;147 g;Salumi e Formaggi;Salumi da Banco
PROSCIUTTO CRUDO 24 MESI;58,80;8,78;147 g;Salumi e Formaggi;Salumi da Banco
BRESAOLA EQUINA;23,90;2,99;100;Salumi e Formaggi;Salumi da Banco
SALAME UNGHERESE;19,90;2,10;100;Salumi e Formaggi;Salumi da Banco
Bresaola della Valtellina IGP;4,99;3,99;100 g;Salumi e Formaggi;Salumi da Banco
ZAMPONE ITALIANO;12,49;7,99;1000 g;Salumi e Formaggi;Salumi da Banco
PANCETTA PIACENTINA DOP;17,50;16,00;100;Salumi e Formaggi;Salumi da Banco
PANCETTA NOSTRANA TESA;12,90;12,00;100;Salumi e Formaggi;Salumi da Banco
Petto di Tacchino al Forno;1,99;1,20;100 g;Salumi e Formaggi;Salumi da Banco
Arrosto di Pollo;9,45;1,30;100;Salumi e Formaggi;Salumi da Banco
Rigatino Toscano;5,09;3,55;100 g;Salumi e Formaggi;Salumi da Banco
Prosciutto di San Daniele DOP in vaschetta;5,79;2,70;90 g;Salumi e Formaggi;Salumi da Banco
Prosciutto Cotto Praga Oro;2,03;1,79;100 g;Salumi e Formaggi;Salumi da Banco
Carne Salada;2,90;2,29;100 g;Salumi e Formaggi;Salumi da Banco
Guanciale Amatriciana;5,00;1,35;120 g;Salumi e Formaggi;Salumi da Banco
Fratelli Beretta, salamini piccanti;1,91;1,00;2x42,5 g;Salumi e Formaggi;Snack
Citterio, Un Due Tris! Prosciutto cotto con formag...;2,59;1,79;100 g;Salumi e Formaggi;Snack
Casa Modena Teneroni la Merenda Brioche salata Art...;1,99;1,00;170 g;Salumi e Formaggi;Snack
Handl Tyrol, Tyrolini dolci;2,03;1,39;40 g;Salumi e Formaggi;Snack
Citterio, Un Due Tris! Petto di tacchino al forno...;2,55;1,79;100 g;Salumi e Formaggi;Snack
Casa Modena Teneroni la Merenda Focaccina Artigian...;2,49;1,00;200 g;Salumi e Formaggi;Snack
Fratelli Beretta, salamini;2,39;1,91;2x42,5 g;Salumi e Formaggi;Snack
Citterio - Unduetris! Salame;2,57;1,49;100 g;Salumi e Formaggi;Snack
COTECHINO MODENA IGP BENCOTTI;6,89;4,49;500 g;Salumi e Formaggi;Snack
Teneroni la Merenda Focaccina Artigianale con Cube...;1,77;1,21;175 g;Salumi e Formaggi;Snack
Spuntino Maxi Salame Milano;1,59;0,87;60 g;Salumi e Formaggi;Snack
Snack & Vai! Parmigiano Reggiano Dop e Tarallini G...;1,19;0,89;37 g;Salumi e Formaggi;Snack
Stinco di Suino;5,99;3,19;650 g;Salumi e Formaggi;Snack
Lenticchie di Castelluccio di Norcia IGP;;5,99;500 g;Salumi e Formaggi;Snack
Esselunga I Pronti in Tavola Cotechino con lenticc...;;13,99;;Salumi e Formaggi;Snack
Fratelli Beretta, Merendino Panino Mortadella + Fr...;1,79;1,49;173 g;Salumi e Formaggi;Snack
MERENDINO PANINO Prosciutto Crudo + Frullato Pesca...;1,79;1,49;173 g;Salumi e Formaggi;Snack
MERENDINO PANINO Prosciutto Cotto + Formaggio + Fr...;1,79;1,49;183 g;Salumi e Formaggi;Snack
Citterio, Salsiccia piccante Napoli a fette;;2,99;60 g;Salumi e Formaggi;Snack
Casa Modena - Teneroni Classici;;3,16;150 g;Salumi e Formaggi;Snack
Citterio, Gli Irresistibili salamini;;1,89;75 g;Salumi e Formaggi;Snack
Merendino Panino Prosciutto Crudo + Frullato Pesca;;1,99;;Salumi e Formaggi;Snack
Spuntino Roll Ventricina e Formaggio;1,99;1,79;60 g;Salumi e Formaggi;Snack
Cheese & Crackers;1,79;1,25;80 g;Salumi e Formaggi;Snack
Minimini Stick Classici;;1,00;60 g;Salumi e Formaggi;Snack
Mini Salami Piccanti;;1,89;150 g;Salumi e Formaggi;Snack
Mini Salami Classici;;1,89;150 g;Salumi e Formaggi;Snack
CUBETTI DI SPECK;2,79;1,79;50 g;Salumi e Formaggi;Snack
Giravolte Crocca&Fila Prosciutto cotto Mozzarella...;;2,29;170 g;Salumi e Formaggi;Snack
Tyrolini Salamini Piccanti;;2,19;90 g;Salumi e Formaggi;Snack
Tyrolini Salamini Dolci;;2,19;90 g;Salumi e Formaggi;Snack
Teneroni Mini Baguette con Prosciutto Crudo in Fet...;;1,75;;Salumi e Formaggi;Snack
Speck Alto Adige Igp;20,90;1,75;100 g;Salumi e Formaggi;Speck, Coppa e Pancetta
Bresaola Della Valtellina I.g.p. Punta D'anca;26,00;2,29;100 g;Salumi e Formaggi;Speck, Coppa e Pancetta
Speck Alto Adige Igp;2,54;1,99;100 g;Salumi e Formaggi;Speck, Coppa e Pancetta
PANCETTA ARROTOLATA AFFETTATA;2,50;0,99;100 g;Salumi e Formaggi;Speck, Coppa e Pancetta
Pancetta Arrotolata Da Suini Italiani;1,99;1,40;100 g;Salumi e Formaggi;Speck, Coppa e Pancetta
COPPA;3,19;2,17;100 g;Salumi e Formaggi;Speck, Coppa e Pancetta
SPECK IGP;2,99;2,19;100 g;Salumi e Formaggi;Speck, Coppa e Pancetta
PANCETTA COPPATA;14,90;1,49;100;Salumi e Formaggi;Speck, Coppa e Pancetta
Tulip, Bacon pancetta affumicata a fette;2,69;2,15;150 g;Salumi e Formaggi;Speck, Coppa e Pancetta
Recla, speck Alto Adige IGP a fette;4,17;2,48;90 g;Salumi e Formaggi;Speck, Coppa e Pancetta
Coppa Stagionatura Minima 8 Mesi da Suini 100% Ita...;2,36;2,00;110 g;Salumi e Formaggi;Speck, Coppa e Pancetta
Pancetta Arrotolata Stagionatura Minima 8 Mesi Da...;2,00;1,98;110 g;Salumi e Formaggi;Speck, Coppa e Pancetta
Coppa Da Suini Italiani;2,30;1,72;100 g;Salumi e Formaggi;Speck, Coppa e Pancetta
Speck;7,30;5,10;400 g;Salumi e Formaggi;Speck, Coppa e Pancetta
COPPA AFFETTATA;1,79;1,00;120 g;Salumi e Formaggi;Speck, Coppa e Pancetta
Citterio, Sofficette speck Alto Adige IGP a fette;2,09;1,00;60 g;Salumi e Formaggi;Speck, Coppa e Pancetta
Negroni Coppa;2,59;1,99;100 g;Salumi e Formaggi;Speck, Coppa e Pancetta
Lardo Salato;2,49;1,48;100 g;Salumi e Formaggi;Speck, Coppa e Pancetta
Pancetta Arrotolata Dolce;1,99;1,40;100 g;Salumi e Formaggi;Speck, Coppa e Pancetta
Speck Alto Adige Igp Senfter;3,00;2,28;120 g;Salumi e Formaggi;Speck, Coppa e Pancetta
SPECK AFFETTATO;4,00;1,69;100 g;Salumi e Formaggi;Speck, Coppa e Pancetta
Recla pancetta Alto Adige;7,90;6,53;250 g;Salumi e Formaggi;Speck, Coppa e Pancetta
Origgi e Colombo pollo affumicato in straccetti;;3,29;120 g;Salumi e Formaggi;Speck, Coppa e Pancetta
Gigi Bacon Pancetta affumicata;;2,49;100 g;Salumi e Formaggi;Speck, Coppa e Pancetta
Fumagalli, pancetta stagionata a fette;;3,56;100 g;Salumi e Formaggi;Speck, Coppa e Pancetta
Salumificio San Carlo, i Piacentini pancetta piace...;;4,49;100 g;Salumi e Formaggi;Speck, Coppa e Pancetta
Salumificio San Carlo, gli Affettati pancetta copp...;;4,07;100 g;Salumi e Formaggi;Speck, Coppa e Pancetta
Esselunga, speck Alto Adige IGP a fette;;3,39;100 g;Salumi e Formaggi;Speck, Coppa e Pancetta
Citterio - Sofficette Coppa;;2,89;60 g;Salumi e Formaggi;Speck, Coppa e Pancetta
Citterio taglio fresco Grangusto;;4,19;120 g;Salumi e Formaggi;Speck, Coppa e Pancetta
Speck Stagionato Affettato;;1,00;120 g;Salumi e Formaggi;Speck, Coppa e Pancetta
Speck Artigianale 100% Posato a Mano;3,40;2,59;80 g;Salumi e Formaggi;Speck, Coppa e Pancetta
Crostata Albicocca;4,70;2,51;400 g;Pane, Pasticceria, Grissini e Crackers;Pasticceria e Torte
AMARETTI;4,05;1,00;200 g;Pane, Pasticceria, Grissini e Crackers;Pasticceria e Torte
Cannoli Siciliani;4,70;2,19;200 g;Pane, Pasticceria, Grissini e Crackers;Pasticceria e Torte
Fagottino Cioccolato;0,95;0,06;75 g;Pane, Pasticceria, Grissini e Crackers;Pasticceria e Torte
Bauli Panettone Di Verona;7,99;4,99;1000 g;Pane, Pasticceria, Grissini e Crackers;Pasticceria e Torte
Torta Al Limone Con Ripieno Di Crema Al Limone;3,40;2,99;500 g;Pane, Pasticceria, Grissini e Crackers;Pasticceria e Torte
Torta Croccante Di Pasta Frolla Alle Nocciole E Ca...;3,40;2,99;500 g;Pane, Pasticceria, Grissini e Crackers;Pasticceria e Torte
Torta Al Cioccolato Con Ripieno Di Crema Al Ciocco...;3,40;2,99;500 g;Pane, Pasticceria, Grissini e Crackers;Pasticceria e Torte
Canestrelli;3,99;2,79;280 g;Pane, Pasticceria, Grissini e Crackers;Pasticceria e Torte
MERINGHE;1,75;1,39;150 g;Pane, Pasticceria, Grissini e Crackers;Pasticceria e Torte
STRUDELINI;2,95;1,00;200 g;Pane, Pasticceria, Grissini e Crackers;Pasticceria e Torte
LINGUA DI GATTO;2,95;1,00;200 g;Pane, Pasticceria, Grissini e Crackers;Pasticceria e Torte
BACI DI DAMA MANDORLA;2,95;1,00;200 g;Pane, Pasticceria, Grissini e Crackers;Pasticceria e Torte
FERRI DI CAVALLO;2,59;1,00;200 g;Pane, Pasticceria, Grissini e Crackers;Pasticceria e Torte
Panettone Classico;12,90;7,14;1000 g;Pane, Pasticceria, Grissini e Crackers;Pasticceria e Torte
Trancio Torta Mele;1,69;1,29;100 g;Pane, Pasticceria, Grissini e Crackers;Pasticceria e Torte
Crostata Frutta Fresca;3,45;3,30;200 g;Pane, Pasticceria, Grissini e Crackers;Pasticceria e Torte
Cannoncini Crema Bianca;2,18;1,29;90 g;Pane, Pasticceria, Grissini e Crackers;Pasticceria e Torte
Ciambella con Carote e Mandorle;;3,49;370 g;Pane, Pasticceria, Grissini e Crackers;Pasticceria e Torte
Krapfen Crema;0,99;0,59;60 g;Pane, Pasticceria, Grissini e Crackers;Pasticceria e Torte
Brioches Marmellata;0,80;0,75;60 g;Pane, Pasticceria, Grissini e Crackers;Pasticceria e Torte
TARTUFATA;13,99;7,90;500 g;Pane, Pasticceria, Grissini e Crackers;Pasticceria e Torte
Tre Marie Il Panettone Milanese senza canditi;12,19;11,90;1000 g;Pane, Pasticceria, Grissini e Crackers;Pasticceria e Torte
Tremarie Panettone Milanese;12,19;11,90;1000 g;Pane, Pasticceria, Grissini e Crackers;Pasticceria e Torte
Esselunga Torta ai marrons glace';;8,49;450 g;Pane, Pasticceria, Grissini e Crackers;Pasticceria e Torte
Le Grazie Pandoro classico;7,90;4,99;1000 g;Pane, Pasticceria, Grissini e Crackers;Pasticceria e Torte
Loison Panettone senza canditi a.D. 1476;18,63;14,90;750 g;Pane, Pasticceria, Grissini e Crackers;Pasticceria e Torte
Loison Panettone Classico a.D. 1476;18,63;14,90;750 g;Pane, Pasticceria, Grissini e Crackers;Pasticceria e Torte
"G. Cova & C. Panettone con ""Pistacchio Verde di Br...";14,40;10,90;1000 g;Pane, Pasticceria, Grissini e Crackers;Pasticceria e Torte
G. Cova & C. Panettone Classico;20,90;13,90;1 .5 kg;Pane, Pasticceria, Grissini e Crackers;Pasticceria e Torte
G. Cova & C Panettone Classico;14,90;9,90;1000 g;Pane, Pasticceria, Grissini e Crackers;Pasticceria e Torte
Maina Il Pandoro ricetta classica;7,99;3,99;1000 g;Pane, Pasticceria, Grissini e Crackers;Pasticceria e Torte
"Molino Spadoni - Farina, di Grano Tenero Tipo ""00""";3,19;0,99;1000 g;Pane, Pasticceria, Grissini e Crackers;Farina
Preparato Per Pizza Integrale;2,99;1,00;400;Pane, Pasticceria, Grissini e Crackers;Farina
Molino Spadoni Gran Mugnaio Farina di grano tenero...;1,18;0,97;1000 g;Pane, Pasticceria, Grissini e Crackers;Farina
"Barilla Farina Tipo ""00"" di Grano Tenero";1,25;0,70;1000 g;Pane, Pasticceria, Grissini e Crackers;Farina
Molino Filippini Biologico Farina di Riso Integral...;2,34;1,00;375 g;Pane, Pasticceria, Grissini e Crackers;Farina
FARINA GRANO DI SARACENO;3,19;1,00;500 g;Pane, Pasticceria, Grissini e Crackers;Farina
Schär Mix it!;4,49;2,00;1000 g;Pane, Pasticceria, Grissini e Crackers;Farina
Molino Spadoni, farina tipo 1 di grano tenero;5,79;2,99;1000 g;Pane, Pasticceria, Grissini e Crackers;Farina
FARINA BIO DI GRANO SARACENO;3,79;2,49;500 g;Pane, Pasticceria, Grissini e Crackers;Farina
Farina Tipo 00;1,69;1,19;1000 g;Pane, Pasticceria, Grissini e Crackers;Farina
Semolato Di Grano Duro Varietà Cappelli Macinato F...;2,24;2,00;1000 g;Pane, Pasticceria, Grissini e Crackers;Farina
Semola Di Grano Duro Biologica;1,14;1,00;1000 g;Pane, Pasticceria, Grissini e Crackers;Farina
Farina Kamut Biologica;4,29;3,21;1000 g;Pane, Pasticceria, Grissini e Crackers;Farina
Farina Di Grano Tenero Integrale Biologica;1,11;1,00;1000 g;Pane, Pasticceria, Grissini e Crackers;Farina
Farina Di Farro Biologica;2,54;2,00;1000 g;Pane, Pasticceria, Grissini e Crackers;Farina
Preparato Per Pizza;1,70;1,00;400;Pane, Pasticceria, Grissini e Crackers;Farina
Preparato Per Pane;1,40;1,00;500 g;Pane, Pasticceria, Grissini e Crackers;Farina
Preparato Per Pane Con Farro, Grano Saraceno, Quin...;2,50;2,00;500 g;Pane, Pasticceria, Grissini e Crackers;Farina
Preparato Per Pane Integrale Con Fiocchi Di Avena...;2,50;2,00;500 g;Pane, Pasticceria, Grissini e Crackers;Farina
Preparato Per Pane Ai 5 Cereali Biologico;2,90;2,00;500 g;Pane, Pasticceria, Grissini e Crackers;Farina
Preparato Per Focaccia;2,50;2,00;500 g;Pane, Pasticceria, Grissini e Crackers;Farina
"Farina Di Grano Tenero Tipo ""00"" Biologica";1,07;1,00;1000 g;Pane, Pasticceria, Grissini e Crackers;Farina
FARINA GRANO TENERO TIPO 1;1,89;1,10;500 g;Pane, Pasticceria, Grissini e Crackers;Farina
la Molisana Semola Integrale Rimacinata Grano Deco...;2,29;1,00;1000 g;Pane, Pasticceria, Grissini e Crackers;Farina
Garofalo Tutto il buono della farina W 260;1,95;1,39;1000 g;Pane, Pasticceria, Grissini e Crackers;Farina
Garofalo Farina W260;1,79;0,99;1000 g;Pane, Pasticceria, Grissini e Crackers;Farina
Farina di ceci;2,39;1,00;500 g;Pane, Pasticceria, Grissini e Crackers;Farina
Farina Tipo 2;2,50;2,00;1000 g;Pane, Pasticceria, Grissini e Crackers;Farina
Farina Tipo 1;2,50;2,00;1000 g;Pane, Pasticceria, Grissini e Crackers;Farina
Farina Che Lievita;;1,69;1000 g;Pane, Pasticceria, Grissini e Crackers;Farina
Farina di Grano Saraceno Integrale Biologica;3,29;2,39;500 g;Pane, Pasticceria, Grissini e Crackers;Farina
Farina di Ceci;2,40;1,99;500 g;Pane, Pasticceria, Grissini e Crackers;Farina
Paneangeli Lievito Vaniglinato X12;4,49;2,99;16 g;Pane, Pasticceria, Grissini e Crackers;Lieviti
Molino Rossetto - Lievito Madre, Essiccato;2,35;0,99;100 g;Pane, Pasticceria, Grissini e Crackers;Lieviti
FECOLA DI PATATE;1,25;0,89;250 g;Pane, Pasticceria, Grissini e Crackers;Lieviti
Lievito Vanigliato Per Dolci;1,15;0,70;48 g;Pane, Pasticceria, Grissini e Crackers;Lieviti
Lievito Madre Attivo Biologico;2,49;2,19;250 g;Pane, Pasticceria, Grissini e Crackers;Lieviti
Cameo - Miscela 9 Torte, per l'Impasto;2,15;1,00;380 g;Pane, Pasticceria, Grissini e Crackers;Lieviti
Lievito Di Birra Disidratato;1,19;0,80;30 g;Pane, Pasticceria, Grissini e Crackers;Lieviti
"Biosun ""lievito "" per Dolci e Salati Biologico 3 B...";1,25;0,90;48 g;Pane, Pasticceria, Grissini e Crackers;Lieviti
Paneangeli Lievito per Pane;1,09;0,95;30 g;Pane, Pasticceria, Grissini e Crackers;Lieviti
Lievito Fresco;0,25;0,18;;Pane, Pasticceria, Grissini e Crackers;Lieviti
LIEVITO PER DOLCI;0,97;0,69;80 g;Pane, Pasticceria, Grissini e Crackers;Lieviti
F.lli Rebecchi Valtrebbia, Color dolci blu;2,26;2,00;80 ml;Pane, Pasticceria, Grissini e Crackers;Lieviti
LIEVITO PIZZA BELLA ALTA;;1,45;9 g;Pane, Pasticceria, Grissini e Crackers;Lieviti
VANIGLIA IN BACCA;;4,79;1 pz;Pane, Pasticceria, Grissini e Crackers;Lieviti
LIEVITO PER DOLCI EASYGLUT;;1,05;80 g;Pane, Pasticceria, Grissini e Crackers;Lieviti
AROMA VANIGLIA;;0,79;4 ml;Pane, Pasticceria, Grissini e Crackers;Lieviti
AROMA ARANCIA;;0,79;4 ml;Pane, Pasticceria, Grissini e Crackers;Lieviti
Lievito Madre Integrale;;2,19;100 g;Pane, Pasticceria, Grissini e Crackers;Lieviti
Lievito Vanigliato per Dolci 3 x 16 g;;0,65;48 g;Pane, Pasticceria, Grissini e Crackers;Lieviti
Lievito Vaniglinato 4 x 16 g;;1,89;80 g;Pane, Pasticceria, Grissini e Crackers;Lieviti
Aroma Limone;;0,79;4 ml;Pane, Pasticceria, Grissini e Crackers;Lieviti
Lievito Dolci 4 Buste;;0,45;64 g;Pane, Pasticceria, Grissini e Crackers;Lieviti
Martinucci, semola rimacinata di grano duro;;3,90;1000 g;Pane, Pasticceria, Grissini e Crackers;Lieviti
Pedon, Easyglut preparato per torta al cacao e muf...;;2,29;400 g;Pane, Pasticceria, Grissini e Crackers;Lieviti
Paneangeli Lievito Mastroforn.3Bs;1,09;0,94;21 g;Pane, Pasticceria, Grissini e Crackers;Lieviti
Paneangeli Mastro Fornaio X3;;1,19;21 g;Pane, Pasticceria, Grissini e Crackers;Lieviti
Lievito Madre Essiccato;;1,79;100 g;Pane, Pasticceria, Grissini e Crackers;Lieviti
Lievito di Birra Mastro Fornaio;;0,95;21 g;Pane, Pasticceria, Grissini e Crackers;Lieviti
Lievito in Polvere;;0,49;42 g;Pane, Pasticceria, Grissini e Crackers;Lieviti
Lievito Fresco;;0,11;42 g;Pane, Pasticceria, Grissini e Crackers;Lieviti
Polvere Lievitante per Dolci;;0,59;150 g;Pane, Pasticceria, Grissini e Crackers;Lieviti
Lievito per Biscotti Ammoniaca;;0,82;24 g;Pane, Pasticceria, Grissini e Crackers;Lieviti
Molino Spadoni Preparato per pane nero;2,95;1,99;1000 g;Pane, Pasticceria, Grissini e Crackers;Preparati pane e pizza
"Molino Vigevano Mix a base di farina tipo ""1"" per...";2,59;1,00;500 g;Pane, Pasticceria, Grissini e Crackers;Preparati pane e pizza
Preparato per Pane con la Curcuma;;2,00;1000 g;Pane, Pasticceria, Grissini e Crackers;Preparati pane e pizza
Molino Spadoni Pane farro & grano saraceno;2,30;2,00;1000 g;Pane, Pasticceria, Grissini e Crackers;Preparati pane e pizza
la Molisana Semola per Pizza di Grano;2,29;1,00;1000 g;Pane, Pasticceria, Grissini e Crackers;Preparati pane e pizza
Barilla, Senza Glutine preparato per pane;2,50;2,48;500 g;Pane, Pasticceria, Grissini e Crackers;Preparati pane e pizza
Molino Vigevano Farine Professionali Farina Bio Po...;;2,59;500 g;Pane, Pasticceria, Grissini e Crackers;Preparati pane e pizza
Frumenta, preparato per pizza verace;;2,27;1000 g;Pane, Pasticceria, Grissini e Crackers;Preparati pane e pizza
