Name;Full Price;Current Price;Quantity;Category;Subcategory
Giovanni Rana Gnocchetti freschi di patate;2,40;1,11;500 g;Pasta e Riso;Gnocchi
GNOCCHI DI PATATE CON ZUCCA;1,92;0,48;400 g;Pasta e Riso;Gnocchi
Gnocchi di Patate;2,79;1,19;500 g;Pasta e Riso;Gnocchi
Gnocchetti Di Patate Freschi;1,00;0,89;500 g;Pasta e Riso;Gnocchi
GNOCCHI CASALINGHI;1,99;0,37;500 g;Pasta e Riso;Gnocchi
CHICCHE DI PATATA;2,50;1,75;500 g;Pasta e Riso;Gnocchi
Il Pastaio, Gnocchi integrali;1,59;1,55;500 g;Pasta e Riso;Gnocchi
Il Pastaio, Gnocchi ripieni speck e brie;3,19;1,60;400 g;Pasta e Riso;Gnocchi
I Tipici Spätzle Freschi Gnocchetti Tirolesi agli...;1,99;1,00;350 g;Pasta e Riso;Gnocchi
Gnocchetti Tenerotti Minions;2,49;2,35;500 g;Pasta e Riso;Gnocchi
Gnocchi con Radicchio;2,49;1,89;400 g;Pasta e Riso;Gnocchi
Spatzle Tricolore;3,29;2,00;500 g;Pasta e Riso;Gnocchi
CHICCHE DI PATATE;2,84;1,29;500 g;Pasta e Riso;Gnocchi
Il Pastaio, I Classici Gnocchi di patata;;1,59;500 g;Pasta e Riso;Gnocchi
GNOCCHI HAPPY FIGURE;3,19;2,55;200 g;Pasta e Riso;Gnocchi
Patarò, Gnocchi di patate senza glutine;;3,08;400 g;Pasta e Riso;Gnocchi
Il Pastaio, Freschissimi gnocchi di patata;;2,75;500 g;Pasta e Riso;Gnocchi
Il Pastaio, Freschissimi chicche tricolori;;2,75;500 g;Pasta e Riso;Gnocchi
Bocon, Spätzle gnocchetti tirolesi;;2,99;350 g;Pasta e Riso;Gnocchi
Bocon, Sfida alla nonna! Canederli mini allo speck;;3,55;350 g;Pasta e Riso;Gnocchi
Esselunga, Gnocchi freschi di patate;;1,49;500 g;Pasta e Riso;Gnocchi
Esselunga Gnocchi freschi di patate;;7,90;;Pasta e Riso;Gnocchi
Esselunga, Gnocchetti freschi di patate;;1,49;500 g;Pasta e Riso;Gnocchi
Esselunga Top, Gnocchi freschi di patate;;2,89;400 g;Pasta e Riso;Gnocchi
GNOCCHI RAPA ROSSA;2,99;1,50;400 g;Pasta e Riso;Gnocchi
CHICCHE FRESCHE DI PATATE;1,99;1,14;200 g;Pasta e Riso;Gnocchi
GNOCCHI FRESCHI ZUCCA;2,89;1,34;400 g;Pasta e Riso;Gnocchi
GNOCCHI FRESCHI SPINACI;2,89;1,34;400 g;Pasta e Riso;Gnocchi
Gnocchi alla Romana;1,99;1,59;500 g;Pasta e Riso;Gnocchi
GNOCCHI RIPIENI SPECK E BRIE;;2,59;400 g;Pasta e Riso;Gnocchi
Gnocchetti tricolore;;3,30;500 g;Pasta e Riso;Gnocchi
Gnocchi di Patate;;2,90;500 g;Pasta e Riso;Gnocchi
Integrale Farfalle;1,19;0,78;500 g;Pasta e Riso;Pasta Integrale
De Cecco Fusilli n°34 Integrali;1,69;0,99;500 g;Pasta e Riso;Pasta Integrale
Farfalline All'uovo Biologiche;0,95;0,79;275 g;Pasta e Riso;Pasta Integrale
Semola Integrale Barilla, Pennette Rigate Integral...;1,09;0,54;400 g;Pasta e Riso;Pasta Integrale
Barilla Senza Glutine Penne Rigate;1,85;1,00;400 g;Pasta e Riso;Pasta Integrale
Barilla Casarecce di Ceci;2,89;2,85;250 g;Pasta e Riso;Pasta Integrale
Garofalo, Legumi Radiatore senza glutine;2,79;1,99;400 g;Pasta e Riso;Pasta Integrale
SPAGHETTI INTEGRALI;3,15;0,99;500 g;Pasta e Riso;Pasta Integrale
SPAGHETTI INTEGRALI;2,99;0,69;500 g;Pasta e Riso;Pasta Integrale
Rummo, Senza Glutine Penne Rigate n. 66 pasta di r...;2,45;1,49;400 g;Pasta e Riso;Pasta Integrale
Barilla, Legumotti 100% farina di Legumi lenticchi...;3,49;2,99;300 g;Pasta e Riso;Pasta Integrale
Penne Rigate Semola Integrale;0,95;0,49;500 g;Pasta e Riso;Pasta Integrale
Senza Glutine Mezze Penne Multicereali Biologiche...;;2,20;400 g;Pasta e Riso;Pasta Integrale
Senza Glutine Maniche Multicereali Biologiche Di M...;;2,20;400 g;Pasta e Riso;Pasta Integrale
Senza Glutine Caserecce Multicereali Biologiche Di...;;2,20;400 g;Pasta e Riso;Pasta Integrale
Senza Glutine Spaghetti Mais E Riso;1,49;1,19;500 g;Pasta e Riso;Pasta Integrale
Senza Glutine Penne Rigate Mais E Riso;1,49;1,19;500 g;Pasta e Riso;Pasta Integrale
Senza Glutine Ditali Rigati Mais E Riso;1,49;1,19;500 g;Pasta e Riso;Pasta Integrale
Senza Glutine Fusilli Mais E Riso;1,49;1,19;500 g;Pasta e Riso;Pasta Integrale
Tagliatelle All'uovo Di Farro Biologiche;;2,29;250 g;Pasta e Riso;Pasta Integrale
Ditalini All'uovo Biologici;0,95;0,89;250 g;Pasta e Riso;Pasta Integrale
Tortiglioni Kamut Biologici;;2,69;500 g;Pasta e Riso;Pasta Integrale
Stelline Di Semolato Biologiche;0,90;0,75;500 g;Pasta e Riso;Pasta Integrale
Spaghetti Di Farro Biologici;1,99;1,89;500 g;Pasta e Riso;Pasta Integrale
Spaghetti Di Semolato Biologici;0,90;0,75;500 g;Pasta e Riso;Pasta Integrale
Pennette Di Farro Biologiche;1,99;1,89;500 g;Pasta e Riso;Pasta Integrale
Mezze Penne Rigate Di Semolato Biologiche;0,90;0,75;500 g;Pasta e Riso;Pasta Integrale
Mezze Penne Kamut Biologiche;;2,69;500 g;Pasta e Riso;Pasta Integrale
Mezze Maniche Biologiche Integrali;0,90;0,75;500 g;Pasta e Riso;Pasta Integrale
Lumachine Di Semolato Biologiche;0,90;0,75;500 g;Pasta e Riso;Pasta Integrale
Fusilli Di Farro Biologici;1,99;1,89;500 g;Pasta e Riso;Pasta Integrale
Farfalle Kamut Biologiche;2,70;2,00;500 g;Pasta e Riso;Pasta Integrale
Giovanni Rana Sfogliavelo Ricotta e Spinaci;3,99;1,59;250 g;Pasta e Riso;Pasta Ripiena
Giovanni Rana Sfogliavelo Carne;1,99;0,83;125 g;Pasta e Riso;Pasta Ripiena
Giovanni Rana Sfogliavelo Ricotta e spinaci;1,99;0,83;125 g;Pasta e Riso;Pasta Ripiena
Giovanni Rana Sfogliavelo Crudo;1,99;0,83;125 g;Pasta e Riso;Pasta Ripiena
Giovanni Rana Gioiaverde funghi;4,90;1,59;250 g;Pasta e Riso;Pasta Ripiena
Giovanni Rana Rustici Cappelletti crudo;3,49;1,00;250 g;Pasta e Riso;Pasta Ripiena
Giovanni Rana Gioiaverde zucca;4,90;1,59;250 g;Pasta e Riso;Pasta Ripiena
Giovanni Rana Rustici Tortelloni Ricotta e Spinaci;4,90;1,00;250 g;Pasta e Riso;Pasta Ripiena
Barilla Emiliane Tortellini con Prosciutto Crudo;1,99;0,89;250 g;Pasta e Riso;Pasta Ripiena
Giovanni Rana, Duetto salsiccia - patate;3,59;2,23;250 g;Pasta e Riso;Pasta Ripiena
Giovanni Rana, Duetto burrata - basilico;3,59;2,00;250 g;Pasta e Riso;Pasta Ripiena
Giovanni Rana Gioiaverde radicchio;3,99;1,59;250 g;Pasta e Riso;Pasta Ripiena
Giovanni Rana Rustici Tortellini casarecci;3,49;1,00;250 g;Pasta e Riso;Pasta Ripiena
Giovanni Rana Rustici Tortellini carne;3,59;1,89;250 g;Pasta e Riso;Pasta Ripiena
Agnolotti alla Piemontese;4,90;4,00;400 g;Pasta e Riso;Pasta Ripiena
Giovanni Rana Sfogliavelo Speck e Formaggio Tirole...;2,99;1,49;250 g;Pasta e Riso;Pasta Ripiena
Giovanni Rana Duetto Noci in pezzi - Gorgonzola D....;3,59;1,89;250 g;Pasta e Riso;Pasta Ripiena
Rana - Sfogliavelo Prosciutto Crudo;6,00;1,59;250 g;Pasta e Riso;Pasta Ripiena
TORTELLINI AL PROSCIUTTO CRUDO;1,79;1,29;250 g;Pasta e Riso;Pasta Ripiena
Tortelloni Freschi Ricotta e Spinaci;1,39;1,00;250 g;Pasta e Riso;Pasta Ripiena
Tortelloni Freschi con Funghi Porcini;1,39;1,00;250 g;Pasta e Riso;Pasta Ripiena
Tortellini Freschi Con Prosciutto Crudo;1,39;1,00;250 g;Pasta e Riso;Pasta Ripiena
Tortellini Freschi Alla Carne;1,39;1,00;250 g;Pasta e Riso;Pasta Ripiena
Ravioli di Zucca;3,45;2,79;250 g;Pasta e Riso;Pasta Ripiena
Ravioli Di Zucca;3,45;2,24;250 g;Pasta e Riso;Pasta Ripiena
Tortelloni Freschi Con Ricotta E Spinaci;1,55;1,39;250 g;Pasta e Riso;Pasta Ripiena
Tortelloni Freschi Con Funghi Porcini;1,55;1,39;250 g;Pasta e Riso;Pasta Ripiena
Tortellini Freschi Alla Carne;1,55;1,39;250 g;Pasta e Riso;Pasta Ripiena
Tortellini Alla Bolognese;3,49;2,24;250 g;Pasta e Riso;Pasta Ripiena
Barilla Emiliane Cappelletti con Carne;3,49;0,89;250 g;Pasta e Riso;Pasta Ripiena
Giovanni Rana Sfogliavelo Carne;2,75;2,29;250 g;Pasta e Riso;Pasta Ripiena
Giovanni Rana Gioiaverde carciofi;2,65;1,59;250 g;Pasta e Riso;Pasta Ripiena
Giovanni Rana Sfogliagrezza Lasagne fresche all'uo...;3,79;1,00;250 g;Pasta e Riso;Pasta all'uovo fresca
Giovanni Rana Sfogliavelo Lasagne fresche all'uovo...;4,29;0,95;250 g;Pasta e Riso;Pasta all'uovo fresca
Giovanni Rana Sfogliagrezza Pappardelle;1,75;0,99;250 g;Pasta e Riso;Pasta all'uovo fresca
Giovanni Rana Sfogliavelo Brasato;2,63;1,49;250 g;Pasta e Riso;Pasta all'uovo fresca
Lasagne Fresche all'Uovo;1,08;1,00;250 g;Pasta e Riso;Pasta all'uovo fresca
Lasagne Fresche Pasta All'uovo;1,45;1,08;250 g;Pasta e Riso;Pasta all'uovo fresca
Tagliolini Freschi All'uovo;0,89;0,79;250 g;Pasta e Riso;Pasta all'uovo fresca
Tagliatelle Fresche All'uovo;0,99;0,79;250 g;Pasta e Riso;Pasta all'uovo fresca
TAGLIOLINI ALL'UOVO;1,39;0,75;250 g;Pasta e Riso;Pasta all'uovo fresca
TAGLIATELLE ALL'UOVO;1,19;0,99;250 g;Pasta e Riso;Pasta all'uovo fresca
Pappardelle Fresche All'uovo;0,99;0,79;250 g;Pasta e Riso;Pasta all'uovo fresca
Esselunga Top, Lasagne;2,83;1,69;500 g;Pasta e Riso;Pasta all'uovo fresca
Esselunga Top, lasagne sfoglia rustica;1,49;1,04;250 g;Pasta e Riso;Pasta all'uovo fresca
La Selezione Emiliana Tagliatelle Fresche;;1,99;250 g;Pasta e Riso;Pasta all'uovo fresca
Esselunga Top, Tagliolini;;1,49;250 g;Pasta e Riso;Pasta all'uovo fresca
Esselunga Top, Tagliatelle rustiche;;1,49;250 g;Pasta e Riso;Pasta all'uovo fresca
Esselunga Top, Tagliatelle;;1,49;250 g;Pasta e Riso;Pasta all'uovo fresca
Esselunga Top, Pappardelle rustiche;1,49;1,19;250 g;Pasta e Riso;Pasta all'uovo fresca
Esselunga Top, Pappardelle;1,49;1,19;250 g;Pasta e Riso;Pasta all'uovo fresca
Esselunga Top, Lasagne;1,49;0,99;250 g;Pasta e Riso;Pasta all'uovo fresca
Spaghetti alla Chitarra;;0,99;500 g;Pasta e Riso;Pasta all'uovo fresca
Tagliolini, Pasta Fresca all'Uovo Sfoglia Rustica;0,99;0,79;500 g;Pasta e Riso;Pasta all'uovo fresca
Pappardelle Uovo;0,99;0,79;500 g;Pasta e Riso;Pasta all'uovo fresca
Tagliatelle Fresche all'Uovo;;0,89;250 g;Pasta e Riso;Pasta all'uovo fresca
Pappardelle Fresche all'Uovo;;0,89;250 g;Pasta e Riso;Pasta all'uovo fresca
Tagliolini Freschi all'Uovo;;0,89;250 g;Pasta e Riso;Pasta all'uovo fresca
Tagliolini Freschi 0,250 Kg;;1,00;250 g;Pasta e Riso;Pasta all'uovo fresca
Sfogliagrezza Pappardelle;1,49;0,89;250 g;Pasta e Riso;Pasta all'uovo fresca
Tagliolini Freschi all'Uovo;0,99;0,79;500 g;Pasta e Riso;Pasta all'uovo fresca
Tagliatelle Fresche all'Uovo;0,99;0,79;500 g;Pasta e Riso;Pasta all'uovo fresca
Pastificio Valleoro Tagliatelle;0,99;0,79;400 g;Pasta e Riso;Pasta all'uovo fresca
Pastificio Valleoro Spaghetti Alla Chitarra;0,99;0,79;400 g;Pasta e Riso;Pasta all'uovo fresca
TAGLIATELLE ALL'UOVO;2,59;0,75;250 g;Pasta e Riso;Pasta all'uovo secca
FETTUCCINE ALL'UOVO;1,39;0,75;250 g;Pasta e Riso;Pasta all'uovo secca
Barilla, Emiliane Fettuccine n.175 pasta all'uovo;2,19;1,08;250 g;Pasta e Riso;Pasta all'uovo secca
Barilla - Emiliane, Pappardelle Ricce All'Uovo;1,79;0,71;250 g;Pasta e Riso;Pasta all'uovo secca
PAPPARDELLE ALL'UOVO;1,26;0,59;250 g;Pasta e Riso;Pasta all'uovo secca
Fillo Rettangolare;2,40;1,75;300 g;Pasta e Riso;Pasta all'uovo secca
Tagliatelle Di Campofilone Pasta All'uovo;2,72;2,65;All'uov...;Pasta e Riso;Pasta all'uovo secca
Maccheroni Al Pettine Pasta All'uovo;2,29;1,71;50 ...;Pasta e Riso;Pasta all'uovo secca
Maccheroni Al Pettine Paglia E Fieno Pasta All'uov...;2,29;2,18;Pa...;Pasta e Riso;Pasta all'uovo secca
Fettuccine Di Campofilone Pasta All'uovo;2,72;2,65;All'uov...;Pasta e Riso;Pasta all'uovo secca
Tripolini 181 Pasta All'uovo;0,55;0,49;250 g;Pasta e Riso;Pasta all'uovo secca
Taglioline 295 Pasta All'uovo;0,89;0,88;250 g;Pasta e Riso;Pasta all'uovo secca
Tagliatelle Larghe 299 Pasta All'uovo;0,89;0,88;250 g;Pasta e Riso;Pasta all'uovo secca
Tagliatelle 298 Pasta All'uovo;0,89;0,88;250 g;Pasta e Riso;Pasta all'uovo secca
Stelline 120 Pasta All'uovo;0,55;0,49;250 g;Pasta e Riso;Pasta all'uovo secca
Sorprese 183 Pasta All'uovo;0,55;0,49;250 g;Pasta e Riso;Pasta all'uovo secca
Risina 117 Pasta All'uovo;0,55;0,49;250 g;Pasta e Riso;Pasta all'uovo secca
Quadretti 188 Pasta All'uovo;0,55;0,49;250 g;Pasta e Riso;Pasta all'uovo secca
Pappardelle 402 Pasta All'uovo;0,89;0,88;250 g;Pasta e Riso;Pasta all'uovo secca
Lasagne Gialle 204 Pasta All'uovo;1,69;1,30;500 g;Pasta e Riso;Pasta all'uovo secca
Filini 122 Pasta All'uovo;0,55;0,49;250 g;Pasta e Riso;Pasta all'uovo secca
Luciana Mosconi, Tagliatelline Caserecce pasta all...;2,49;1,79;500 g;Pasta e Riso;Pasta all'uovo secca
Luciana Mosconi, Tagliatelle pasta all'uovo;2,49;1,79;500 g;Pasta e Riso;Pasta all'uovo secca
Luciana Mosconi, Fettuccine pasta all'uovo;2,49;1,79;500 g;Pasta e Riso;Pasta all'uovo secca
Tagliatelle all'uovo Ecor;1,99;1,39;250 g;Pasta e Riso;Pasta all'uovo secca
Bio Farro Integrale Penne Rigate N°41;;2,99;500 g;Pasta e Riso;Pasta all'uovo secca
Fettuccine N° 303 all'Uovo;2,59;2,19;500 g;Pasta e Riso;Pasta all'uovo secca
Pasta all'Uovo Lasagne N.32;3,33;2,49;250 g;Pasta e Riso;Pasta all'uovo secca
Fettuccine Pasta all'Uovo;4,29;0,83;250 g;Pasta e Riso;Pasta all'uovo secca
Lasagne all'Uovo;1,08;0,99;500 g;Pasta e Riso;Pasta all'uovo secca
Tagliatelle Larghe 289 Pasta All'uovo;1,50;1,45;500 g;Pasta e Riso;Pasta all'uovo secca
Tagliatelle 288 Pasta All'uovo;1,50;1,45;500 g;Pasta e Riso;Pasta all'uovo secca
Barilla Penne Rigate n.73 Cello;1,49;0,77;1000 g;Pasta e Riso;Pasta di semola corta
Voiello Farfalle n°192;1,25;0,69;500 g;Pasta e Riso;Pasta di semola corta
Rummo Fusilli n° 48;1,49;0,79;500 g;Pasta e Riso;Pasta di semola corta
Voiello n° 154 Mezze penne rigate;1,30;0,65;500 g;Pasta e Riso;Pasta di semola corta
Barilla Senza Glutine Fusilli;1,44;1,00;400 g;Pasta e Riso;Pasta di semola corta
Voiello Penne Rigate n° 152;1,49;0,65;500 g;Pasta e Riso;Pasta di semola corta
Farfalle Biologiche;1,15;0,75;500 g;Pasta e Riso;Pasta di semola corta
MEZZE PENNE RIGATE N°119;1,15;0,39;500 g;Pasta e Riso;Pasta di semola corta
La Casa del Grano Tradizionali Is Malloreddus Fini;1,59;1,00;500 g;Pasta e Riso;Pasta di semola corta
Rummo Mezzi rigatoni N° 51;1,15;0,69;500 g;Pasta e Riso;Pasta di semola corta
Garofalo Fusilli n. 63;1,49;0,79;500 g;Pasta e Riso;Pasta di semola corta
Integrale Penne Rigate;1,19;1,09;500 g;Pasta e Riso;Pasta di semola corta
Tradizioni Tortellini Ricotta e Spinaci;2,50;1,75;230 g;Pasta e Riso;Pasta di semola corta
Tradizioni Ravioli Brasato;2,49;1,49;230 g;Pasta e Riso;Pasta di semola corta
Pizzoccheri della Valtellina I.G.P.;1,59;1,25;500 g;Pasta e Riso;Pasta di semola corta
Paccheri Pasta Di Gragnano I.g.p.;1,19;1,00;500 g;Pasta e Riso;Pasta di semola corta
Fusilloni Pasta Di Gragnano I.g.p.;1,19;1,00;500 g;Pasta e Riso;Pasta di semola corta
Calamari Pasta Di Gragnano I.g.p.;1,19;1,00;500 g;Pasta e Riso;Pasta di semola corta
Penne Rigate 70;1,00;0,76;1000 g;Pasta e Riso;Pasta di semola corta
Napellini Rigati 42;0,47;0,39;500 g;Pasta e Riso;Pasta di semola corta
Maniche 49;0,47;0,39;500 g;Pasta e Riso;Pasta di semola corta
Linguine 13;0,47;0,39;500 g;Pasta e Riso;Pasta di semola corta
Fusilli 64;1,00;0,76;1000 g;Pasta e Riso;Pasta di semola corta
Elicoidali 47;1,00;0,76;1000 g;Pasta e Riso;Pasta di semola corta
GNOCCHETTI SARDI N°35;0,65;0,49;500 g;Pasta e Riso;Pasta di semola corta
De Cecco Farfalle n° 93;1,99;1,06;500 g;Pasta e Riso;Pasta di semola corta
Voiello Pipe rigate n° 135;1,30;0,65;500 g;Pasta e Riso;Pasta di semola corta
FiberPasta Penne;3,16;3,00;500 g;Pasta e Riso;Pasta di semola corta
Rummo Elicoidali N° 49;1,00;0,94;500 g;Pasta e Riso;Pasta di semola corta
Barilla Pennette Rigate n.72;0,99;0,45;500 g;Pasta e Riso;Pasta di semola corta
Rummo Penne rigate n° 66;1,49;0,79;500 g;Pasta e Riso;Pasta di semola corta
De Cecco Mezze penne rigate n° 141;1,69;1,04;500 g;Pasta e Riso;Pasta di semola corta
Trofie Di Semola Fresche;1,00;0,99;500 g;Pasta e Riso;Pasta di semola fresca
Orecchiette Di Semola Fresche;1,19;0,99;500 g;Pasta e Riso;Pasta di semola fresca
Fusilli Di Semola Freschi;1,19;0,99;500 g;Pasta e Riso;Pasta di semola fresca
TROFIE;2,49;2,29;500 g;Pasta e Riso;Pasta di semola fresca
Gourmet Pizzoccheri;1,09;0,99;250 g;Pasta e Riso;Pasta di semola fresca
Scoiattolo, Fusilli 100% farina di piselli biologi...;1,99;1,39;200 g;Pasta e Riso;Pasta di semola fresca
Nonna Mery, Trofie liguri;;1,49;250 g;Pasta e Riso;Pasta di semola fresca
Esselunga Equilibrio trofie integrali;;2,29;500 g;Pasta e Riso;Pasta di semola fresca
Maffei, Fusilli integrali;1,99;1,29;500 g;Pasta e Riso;Pasta di semola fresca
Maffei, Troccoli;;1,23;250 g;Pasta e Riso;Pasta di semola fresca
Esselunga, Trofie;2,19;1,53;500 g;Pasta e Riso;Pasta di semola fresca
Esselunga, Strozzapreti;2,19;1,53;500 g;Pasta e Riso;Pasta di semola fresca
Esselunga, Orecchiette;;2,15;500 g;Pasta e Riso;Pasta di semola fresca
Esselunga, Cavatelli;;2,19;500 g;Pasta e Riso;Pasta di semola fresca
Esselunga Equilibrio, Orecchiette integrali;;2,29;500 g;Pasta e Riso;Pasta di semola fresca
Fusilli Freschi;0,89;0,69;500 g;Pasta e Riso;Pasta di semola fresca
Pasta Fresca di Semola di Grano Duro, Biologico;0,79;0,50;250 g;Pasta e Riso;Pasta di semola fresca
Pici Senesi;;1,04;250 g;Pasta e Riso;Pasta di semola fresca
Troccoli di Semola Freschi;;1,49;500 g;Pasta e Riso;Pasta di semola fresca
Orecchiettine Fresche;1,79;1,25;500 g;Pasta e Riso;Pasta di semola fresca
Strozzapreti Speciale Sem Atmsac;0,79;0,50;250 g;Pasta e Riso;Pasta di semola fresca
Pasta Biologica;;0,99;250 g;Pasta e Riso;Pasta di semola fresca
Trofie Bio;;0,99;250 g;Pasta e Riso;Pasta di semola fresca
Orecchiette Sem Atmsac;;1,00;250 g;Pasta e Riso;Pasta di semola fresca
Trofiette Fresche;1,99;1,19;500 g;Pasta e Riso;Pasta di semola fresca
Orecchiette;;2,05;500 g;Pasta e Riso;Pasta di semola fresca
Casa Buratti Gnocchi Sorrentini Senza Patate;;1,79;Pat...;Pasta e Riso;Pasta di semola fresca
Casa Milo Biologico Orecchiette Bio;;1,64;400 g;Pasta e Riso;Pasta di semola fresca
Casa Milo Biologico Trofie Bio;1,70;0,93;400 g;Pasta e Riso;Pasta di semola fresca
CAVATELLI FRESCHI;;1,49;500 g;Pasta e Riso;Pasta di semola fresca
Trofiette;;3,05;;Pasta e Riso;Pasta di semola fresca
Tagliolini con Fibre;;0,69;250 g;Pasta e Riso;Pasta di semola fresca
Barilla - Piccolini Mini Farfalle;1,45;0,69;500 g;Pasta e Riso;Pasta di semola lunga
Barilla - Piccolini Mini Penne Rigate;1,45;0,69;500 g;Pasta e Riso;Pasta di semola lunga
Barilla Spaghetti n.5;1,29;0,45;400 g;Pasta e Riso;Pasta di semola lunga
Barilla Semola Capellini n.1;1,25;0,45;500 g;Pasta e Riso;Pasta di semola lunga
Fusilli Bio;2,74;0,50;500 g;Pasta e Riso;Pasta di semola lunga
SPAGHETTINI N°3;1,09;0,84;1000 g;Pasta e Riso;Pasta di semola lunga
Garofalo Casarecce n. 88;1,59;0,79;500 g;Pasta e Riso;Pasta di semola lunga
Voiello, Fusilli n. 141 pasta di semola di grano d...;1,85;0,65;500 g;Pasta e Riso;Pasta di semola lunga
Garofalo, Radiatori n. 87 pasta di semola di grano;1,59;0,89;500 g;Pasta e Riso;Pasta di semola lunga
Rummo Spaghetti Grossi;1,59;0,94;500 g;Pasta e Riso;Pasta di semola lunga
Barilla - Fusilli, n.98;1,25;0,45;500 g;Pasta e Riso;Pasta di semola lunga
Barilla - Mezze Maniche Rigate,;1,35;0,45;400 g;Pasta e Riso;Pasta di semola lunga
Barilla - Bucatini n.9,;1,25;0,45;500 g;Pasta e Riso;Pasta di semola lunga
Rummo Le Leggendarie Mezzi Paccheri Rigati N° 152;1,89;1,29;500 g;Pasta e Riso;Pasta di semola lunga
Rummo Le Leggendarie Fusillotti N° 155;1,89;1,29;500 g;Pasta e Riso;Pasta di semola lunga
Rummo Spaghettoni Grossi N° 220;1,59;0,79;500 g;Pasta e Riso;Pasta di semola lunga
Rummo, Fusilli n. 48 pasta di semola di grano duro;1,69;1,59;500 g;Pasta e Riso;Pasta di semola lunga
Rummo, Conchiglie Rigate n. 42 pasta di semola di...;1,59;0,79;500 g;Pasta e Riso;Pasta di semola lunga
Garofalo - Penne Zite Rigate, Pasta di Semola di G...;1,59;0,89;500 g;Pasta e Riso;Pasta di semola lunga
Bio Farro Integrale Spaghettoni Quadrati N°413;2,99;2,19;500 g;Pasta e Riso;Pasta di semola lunga
5 Cereali Spaghetti;1,29;1,09;400 g;Pasta e Riso;Pasta di semola lunga
Vermicelli;0,77;0,39;500 g;Pasta e Riso;Pasta di semola lunga
Vermicelli 119 Pasta Di Gragnano I.g.p.;0,99;0,70;500 g;Pasta e Riso;Pasta di semola lunga
Spaghetti Alla Chitarra 117 Pasta Di Gragnano I.g....;0,99;0,70;500 g;Pasta e Riso;Pasta di semola lunga
Spaghetti 118 Pasta Di Gragnano I.g.p.;0,99;0,70;500 g;Pasta e Riso;Pasta di semola lunga
Linguine 121 Pasta Di Gragnano I.g.p.;0,74;0,70;500 g;Pasta e Riso;Pasta di semola lunga
Fusilli Lunghi Bucati Pasta Di Gragnano I.g.p.;1,85;1,39;500 g;Pasta e Riso;Pasta di semola lunga
Vermicelli 2;0,47;0,39;500 g;Pasta e Riso;Pasta di semola lunga
Spaghetti Grossi 5;0,47;0,39;500 g;Pasta e Riso;Pasta di semola lunga
Spaghetti 4;1,09;0,76;1000 g;Pasta e Riso;Pasta di semola lunga
SPAGHETTI N°5;0,95;0,59;1000 g;Pasta e Riso;Pasta di semola lunga
LINGUINE N°7;0,82;0,49;500 g;Pasta e Riso;Pasta di semola lunga
Barilla - Risoni, Pasta di Semola di Grano Duro, n...;1,25;0,45;500 g;Pasta e Riso;Pastina
Barilla, Emiliane Sorprese n.110 pasta all'uovo;1,29;0,54;275 g;Pasta e Riso;Pastina
Barilla Penne Rigate Senza Glutine;1,85;1,09;400 g;Pasta e Riso;Pastina
Barilla - Emiliane Garganelli,;2,75;1,39;250 g;Pasta e Riso;Pastina
Filini all'Uovo;0,79;0,35;275 g;Pasta e Riso;Pastina
Grattini all'Uovo;0,79;0,35;275 g;Pasta e Riso;Pastina
Tripolini 81;0,59;0,39;500 g;Pasta e Riso;Pastina
Tempestina 15;0,47;0,39;500 g;Pasta e Riso;Pastina
Lumachine 30;0,59;0,39;500 g;Pasta e Riso;Pastina
Corallini 24;0,47;0,39;500 g;Pasta e Riso;Pastina
STELLINE N°59;0,49;0,39;500 g;Pasta e Riso;Pastina
Barilla, Emiliane Sorprese n.110 pasta all'uovo;1,29;0,40;275 g;Pasta e Riso;Pastina
Esselunga, Tripolini n. 57 pasta di semola di gran...;;0,79;500 g;Pasta e Riso;Pastina
Esselunga, Ditalini Rigati n. 133 pasta di semola...;;0,79;500 g;Pasta e Riso;Pastina
Esselunga, Conchigliette n. 40 pasta di semola di...;;0,79;500 g;Pasta e Riso;Pastina
Esselunga, Filini n. 90 pasta di semola di grano d...;;0,45;250 g;Pasta e Riso;Pastina
Esselunga, Corallini n. 71 pasta di semola di gran...;;0,45;250 g;Pasta e Riso;Pastina
Esselunga, Stelline n. 73 pasta di semola di grano...;;0,45;250 g;Pasta e Riso;Pastina
Esselunga, Anellini n. 28 pasta di semola di grano...;;0,45;250 g;Pasta e Riso;Pastina
Esselunga, Acini di Pepe n. 64 pasta di semola di...;;0,45;250 g;Pasta e Riso;Pastina
Esselunga, Semi di Mela n. 26 pasta di semola di g...;;0,45;250 g;Pasta e Riso;Pastina
Barilla - Tempestine, Pasta Di Semola Di Grano Dur...;;1,25;500 g;Pasta e Riso;Pastina
Pastina N.21 Pepe Bucato;;0,75;250 g;Pasta e Riso;Pastina
Farfalline per Minestra;;0,39;500 g;Pasta e Riso;Pastina
Ditalini Rigati per Minestra;;0,39;500 g;Pasta e Riso;Pastina
FILINI PASTINA ALL'UOVO;;0,49;250 g;Pasta e Riso;Pastina
FARFALLINE PASTINA ALL'UOVO;;0,49;250 g;Pasta e Riso;Pastina
Stelline N°24;;0,75;500 g;Pasta e Riso;Pastina
Semi di Melone Semola di Grano Duro N°20;;0,75;250 g;Pasta e Riso;Pastina
Pastina N°26 Orzo;;0,75;500 g;Pasta e Riso;Pastina
Stelline di Grano Duro;;0,39;500 g;Pasta e Riso;Pastina
Risoni;;0,39;500 g;Pasta e Riso;Pastina
BUITONI LA SFOGLIA ROTONDA SENZA GLUTINE Pasta sfo...;3,49;1,95;280 g;Pasta e Riso;Basi e sfoglie
Coni per Gelato;1,49;0,99;50;Pasta e Riso;Basi e sfoglie
BUITONI LA SFOGLIA DELICATA Pasta sfoglia leggera...;2,35;0,74;230 g;Pasta e Riso;Basi e sfoglie
BUITONI LA BRISÉE SENZA GLUTINE Pasta brisée fresc...;3,55;3,19;230 g;Pasta e Riso;Basi e sfoglie
Cestini per Gelato;2,15;1,99;74;Pasta e Riso;Basi e sfoglie
PASTA BRISEE ROTOLO;0,85;0,68;230 g;Pasta e Riso;Basi e sfoglie
BASE PER PIZZA FRESCA;1,29;0,99;385 g;Pasta e Riso;Basi e sfoglie
Buitoni, Focaccia la soffice;2,70;1,51;375 g;Pasta e Riso;Basi e sfoglie
Buitoni, La Sfoglia integrale rotonda;2,45;1,49;230 g;Pasta e Riso;Basi e sfoglie
Buitoni, La Sfoglia rotonda;1,99;1,35;230 g;Pasta e Riso;Basi e sfoglie
Buitoni, La Sfoglia rettangolare;1,59;1,00;230 g;Pasta e Riso;Basi e sfoglie
BUITONI LA PIZZA ROTONDA SENZA GLUTINE Pasta fresc...;4,35;2,00;260 g;Pasta e Riso;Basi e sfoglie
LA SFOGLIA ROTONDA Pasta sfoglia fresca rotonda ro...;1,49;1,39;230 g;Pasta e Riso;Basi e sfoglie
Pasta Fresca Sfoglia Rettangolare;;0,99;230 g;Pasta e Riso;Basi e sfoglie
Bignoline Bigne';1,19;0,87;100 g;Pasta e Riso;Basi e sfoglie
GRAN PIZZA Pasta per pizza fresca stesa rettangola...;2,59;2,25;460 g;Pasta e Riso;Basi e sfoglie
Cannoli da Riempire 8 x 19 g;3,69;2,75;152 g;Pasta e Riso;Basi e sfoglie
LA SFOGLIATA;2,10;1,49;230 g;Pasta e Riso;Basi e sfoglie
Buitoni la Soffice Pasta Fresca Stesa per Focaccia...;1,95;1,00;375 g;Pasta e Riso;Basi e sfoglie
BUITONI LA FROLLA SOTTILE Pasta frolla sottile fre...;1,29;1,00;230 g;Pasta e Riso;Basi e sfoglie
BUITONI LA SFOGLIA INTEGRALE Pasta sfoglia fresca...;2,05;1,00;230 g;Pasta e Riso;Basi e sfoglie
PANCAKES;2,29;1,69;160 g;Pasta e Riso;Basi e sfoglie
Cerelia Italia Pasta sfoglia rotonda;1,49;0,89;230 g;Pasta e Riso;Basi e sfoglie
Buitoni, La Pizza rotonda senza glutine;3,40;2,04;260 g;Pasta e Riso;Basi e sfoglie
Brisée;;2,39;230 g;Pasta e Riso;Basi e sfoglie
Buitoni, La Brisèe;;1,99;230 g;Pasta e Riso;Basi e sfoglie
Buitoni, Gran Pizza;;3,29;460 g;Pasta e Riso;Basi e sfoglie
Esselunga, pasta sfoglia rotonda;;1,59;230 g;Pasta e Riso;Basi e sfoglie
Esselunga, pasta sfoglia rettangolare;;1,59;230 g;Pasta e Riso;Basi e sfoglie
Esselunga, pasta per pizza;;1,29;385 g;Pasta e Riso;Basi e sfoglie
Esselunga, pasta brisée;;1,69;230 g;Pasta e Riso;Basi e sfoglie
Pasta Julia, Fettuccine Caserecce,;;1,81;200 g;Pasta e Riso;Basi e sfoglie
Knorr, Segreti della Nonna zuppa di fagioli;2,19;1,18;545 g;Pasta e Riso;Minestre e Zuppe - Primi Pronti
Zuppa di Ceci;2,19;1,69;545 g;Pasta e Riso;Minestre e Zuppe - Primi Pronti
Zuppa di Fagioli;1,99;1,09;545 g;Pasta e Riso;Minestre e Zuppe - Primi Pronti
Minestrone Dell'orto;2,49;1,69;500 ml;Pasta e Riso;Minestre e Zuppe - Primi Pronti
Knorr, Gusto Genuino passato tradizionale di 10 ve...;1,89;1,00;500 ml;Pasta e Riso;Minestre e Zuppe - Primi Pronti
Knorr, Gusto Genuino il Minestrone di 13 verdure;1,89;1,00;500 ml;Pasta e Riso;Minestre e Zuppe - Primi Pronti
Knorr, Segreti della Nonna minestrone di legumi;2,12;1,18;545 g;Pasta e Riso;Minestre e Zuppe - Primi Pronti
Knorr - Segreti della Nonna Zuppa di Ceci;2,12;1,18;545 g;Pasta e Riso;Minestre e Zuppe - Primi Pronti
Knorr - Minestrone Con Pasta, 133 G;1,69;0,93;132 g;Pasta e Riso;Minestre e Zuppe - Primi Pronti
