Name;Full Price;Current Price;Quantity;Category;Subcategory
Breeze Men Dry Protection Deodorante spray;2,49;2,00;150 ml;Bellezza e cura della persona;Deodoranti
Borotalco Intensive Deo Roll On;4,25;1,99;50 ml;Bellezza e cura della persona;Deodoranti
Borotalco Fresh Deodorante Spray;3,99;3,49;150 ml;Bellezza e cura della persona;Deodoranti
Dove Deodorante Go Fresh profumo di melograno ed...;2,39;1,18;150 ml;Bellezza e cura della persona;Deodoranti
Borotalco Invisible Deo Spray 0% Alcool;3,99;3,29;150 ml;Bellezza e cura della persona;Deodoranti
Breeze, Neutro deodorante;6,99;3,76;125 ml;Bellezza e cura della persona;Deodoranti
Nivea, Men Cool Kick deodorante spray;3,19;2,00;150 ml;Bellezza e cura della persona;Deodoranti
Tesori Oriente Profumo Mirra;7,85;4,14;100 ml;Bellezza e cura della persona;Deodoranti
DETERGENTE INTIMO;5,84;1,39;300 ml;Bellezza e cura della persona;Doccia e bagnoschiuma
Felce Azzurra, Fresco bagnodoccia;2,99;1,49;650 ml;Bellezza e cura della persona;Doccia e bagnoschiuma
Nivea, Creme Soft bagno crema;2,89;2,22;650 ml;Bellezza e cura della persona;Doccia e bagnoschiuma
Nivea, Creme Care bagno crema;2,85;1,69;650 ml;Bellezza e cura della persona;Doccia e bagnoschiuma
Detergente Intimo Lenitivo;1,79;1,19;300 ml;Bellezza e cura della persona;Doccia e bagnoschiuma
Neutro Roberts, Dermazero bagnodoccia;2,62;1,99;700 ml;Bellezza e cura della persona;Doccia e bagnoschiuma
Felce Azzurra, Muschio Bianco bagnodoccia;2,99;1,49;650 ml;Bellezza e cura della persona;Doccia e bagnoschiuma
Felce Azzurra, Classico bagnodoccia;2,99;1,49;650 ml;Bellezza e cura della persona;Doccia e bagnoschiuma
Nivea, Doccia Olio Natural pelli normali e secche;3,19;2,00;200 ml;Bellezza e cura della persona;Doccia e bagnoschiuma
BAGNO BENESSERE;2,75;1,69;600 ml;Bellezza e cura della persona;Doccia e bagnoschiuma
Con Antibatterico Detergente Intimo;2,95;1,77;200 ml;Bellezza e cura della persona;Doccia e bagnoschiuma
DETERGENTE INTIMO VERDE;6,99;2,19;450 ml;Bellezza e cura della persona;Doccia e bagnoschiuma
Ricarica Detergente Intimo Delicato;2,68;2,65;600 ml;Bellezza e cura della persona;Doccia e bagnoschiuma
Borotalco Fiori d'Arancio Energizzante;3,58;1,79;700 ml;Bellezza e cura della persona;Doccia e bagnoschiuma
Palmolive, Naturals latte e oliva bagnodoccia crem...;2,19;1,31;650 ml;Bellezza e cura della persona;Doccia e bagnoschiuma
Neutromed, pH 5.5 Idratante con Pro-Vitamina B5 ba...;2,16;1,43;650 ml;Bellezza e cura della persona;Doccia e bagnoschiuma
Neutro Roberts, Beauty bagnodoccia;3,55;2,13;700 ml;Bellezza e cura della persona;Doccia e bagnoschiuma
Felce Azzurra, Ambra e Argan bagnodoccia;2,99;1,49;650 ml;Bellezza e cura della persona;Doccia e bagnoschiuma
Palmolive, Aroma Sensations So Relaxed doccia schi...;1,22;0,73;250 ml;Bellezza e cura della persona;Doccia e bagnoschiuma
Intesa, Pour Homme Rivitalizzante gel doccia shamp...;2,99;1,78;300 ml;Bellezza e cura della persona;Doccia e bagnoschiuma
BAGNO DOCCIA ALLA MALVA;5,90;4,13;500 ml;Bellezza e cura della persona;Doccia e bagnoschiuma
Tesori d'Oriente, Hammam bagno crema;4,49;3,54;500 ml ++;Bellezza e cura della persona;Doccia e bagnoschiuma
Le Petit Marseillais, Miele di lavanda doccia crem...;2,49;1,00;250 ml;Bellezza e cura della persona;Doccia e bagnoschiuma
BAGNO ORCHIDEA NERA;3,15;1,89;650 ml;Bellezza e cura della persona;Doccia e bagnoschiuma
BAGNO NARCISO;3,15;1,89;650 ml;Bellezza e cura della persona;Doccia e bagnoschiuma
BAGNO IDRATANTE MANDORLE;4,99;2,99;650 ml;Bellezza e cura della persona;Doccia e bagnoschiuma
BAGNO MIELE + SENS.OIL;2,59;1,69;600 ml;Bellezza e cura della persona;Doccia e bagnoschiuma
BAGNO MANDORLA RICARICA;4,29;2,89;1 lt;Bellezza e cura della persona;Doccia e bagnoschiuma
BAGNO IDRATANTE;2,69;1,69;600 ml;Bellezza e cura della persona;Doccia e bagnoschiuma
BAGNO IDRATANTE MANDORLA;2,59;1,47;650 ml;Bellezza e cura della persona;Doccia e bagnoschiuma
Tesori d'Oriente, Japanese Rituals bagno crema aro...;4,90;3,43;500 ml;Bellezza e cura della persona;Doccia e bagnoschiuma
Dermon, doccia schiuma alla Vitamina E;10,80;7,56;400 ml;Bellezza e cura della persona;Doccia e bagnoschiuma
Infasil Intimo Lenitivo pH 5,0;3,29;1,50;200 ml;Bellezza e cura della persona;Igiene Intima
Chilly idratante detergente intimo;2,99;1,69;200 ml;Bellezza e cura della persona;Igiene Intima
Chilly gel detergente intimo;2,99;1,69;200 ml;Bellezza e cura della persona;Igiene Intima
Infasil Intimo Neutro pH 5,5;3,29;1,95;200 ml;Bellezza e cura della persona;Igiene Intima
Chilly delicato detergente intimo;2,83;1,69;200 ml;Bellezza e cura della persona;Igiene Intima
Chilly Neutro Detergente Intimo;2,99;1,69;200 ml;Bellezza e cura della persona;Igiene Intima
Winni's Naturel, detergente intimo;4,11;3,02;250 ml;Bellezza e cura della persona;Igiene Intima
Dermogella, detergente intimo pH 4,5;3,23;1,88;200 ml;Bellezza e cura della persona;Igiene Intima
DETERGENTE INTIMO ANTIBATTERICO;3,17;1,69;200 ml;Bellezza e cura della persona;Igiene Intima
Intima Roberts Tea Tree con Antibatterico;2,75;2,37;200 ml;Bellezza e cura della persona;Igiene Intima
Ph 3.5 Detergente Intimo;3,28;2,99;200 ml;Bellezza e cura della persona;Igiene Intima
Detergente Intimo Ph5;7,99;3,47;250 ml;Bellezza e cura della persona;Igiene Intima
DETERGENTE INTIMO MIX;2,99;2,24;200 ml;Bellezza e cura della persona;Igiene Intima
Vidermina, Deligyn dermodetergente intimo;;15,90;500 ml;Bellezza e cura della persona;Igiene Intima
Vidermina, CLX-attiva detergente intimo;;15,90;500 ml;Bellezza e cura della persona;Igiene Intima
Saugella, Attiva ph 4,5 salviettine intime;;7,86;15 pezzi;Bellezza e cura della persona;Igiene Intima
Dermogella, Intima pH 5.5 detergente intimo;;6,48;500 ml;Bellezza e cura della persona;Igiene Intima
Infasil, Neutro delicato detergente intimo;4,93;3,45;300 ml;Bellezza e cura della persona;Igiene Intima
Infasil, Lenitivo pH 5,0 detergente intimo;4,93;3,45;300 ml;Bellezza e cura della persona;Igiene Intima
Infasil, Freschezza pH 4,5 detergente intimo;4,93;3,45;300 ml;Bellezza e cura della persona;Igiene Intima
Esselunga, Neutro Delicato salviettine intime;;1,79;20 pezzi;Bellezza e cura della persona;Igiene Intima
Saugella, Linea Blu dermoliquido;;10,69;500 ml;Bellezza e cura della persona;Igiene Intima
Saugella, Linea Rosa Poligyn pH neutro detergente...;;17,11;500 ml;Bellezza e cura della persona;Igiene Intima
Saugella, Linea Verde lavanda di attiva pH 4,5 lav...;;12,69;560 ml;Bellezza e cura della persona;Igiene Intima
Saugella, Linea Verde Attiva pH 3,5 detergente int...;;10,05;250 ml;Bellezza e cura della persona;Igiene Intima
Gyno-Canesten, Inthima Cosmetic Lenitivo detergent...;;11,16;200 ml;Bellezza e cura della persona;Igiene Intima
Eucerin, detergente intimo;;8,30;250 ml;Bellezza e cura della persona;Igiene Intima
Dermon, Intimo pH 4,5 detergente intimo delicato;10,90;7,63;500 ml;Bellezza e cura della persona;Igiene Intima
Aveeno, detergente intimo extra delicato;;13,90;500 ml;Bellezza e cura della persona;Igiene Intima
Esselunga, Neutro&Delicato detergente intimo;;1,65;200 ml;Bellezza e cura della persona;Igiene Intima
Esselunga, Neutro&Delicato detergente intimo attiv...;;1,65;200 ml;Bellezza e cura della persona;Igiene Intima
DET. INTIMO MICELLARE LENITIVO;2,49;1,49;250 ml;Bellezza e cura della persona;Igiene Intima
Felce Azzurra, Classico sapone liquido;1,72;1,00;300 ml;Bellezza e cura della persona;Spugne per il corpo
Neutro Roberts doccia shampoo rinfrescante con euc...;2,49;1,49;250 ml;Bellezza e cura della persona;Spugne per il corpo
Palmolive Naturals Moisture Care Sapone da Toilett...;1,74;1,09;360 g;Bellezza e cura della persona;Spugne per il corpo
Dove, Seta Preziosa bagnodoccia nutriente;2,99;1,61;500 ml;Bellezza e cura della persona;Spugne per il corpo
Winni's Naturel, sapone liquido mani;3,66;2,27;250 ml;Bellezza e cura della persona;Spugne per il corpo
Spuma di Sciampagna, Marsiglia sapone liquido;3,29;1,00;500 ml;Bellezza e cura della persona;Spugne per il corpo
Dove, detergente cremoso di bellezza;2,59;0,99;250 ml;Bellezza e cura della persona;Spugne per il corpo
Dove, bagnodoccia nutriente idratante;2,69;1,61;450 ml;Bellezza e cura della persona;Spugne per il corpo
Lactacyd, Sensitive detergente intimo;3,06;1,79;300 ml;Bellezza e cura della persona;Spugne per il corpo
Lactacyd, Lenitivo detergente intimo;3,06;1,79;300 ml;Bellezza e cura della persona;Spugne per il corpo
Pilogen Carezza, Linea Supersapone Tabiano sapone;1,61;1,15;125 g;Bellezza e cura della persona;Spugne per il corpo
Lysoform, Protezione Mani;2,29;1,60;250 ml;Bellezza e cura della persona;Spugne per il corpo
Infasil, Neutro detergente liquido;3,19;2,23;300 ml;Bellezza e cura della persona;Spugne per il corpo
Dove Mousse Doccia con Olio di Rosa;3,49;2,09;200 ml;Bellezza e cura della persona;Spugne per il corpo
SPUGNA BAGNO MASSAGGIO;2,35;0,59;;Bellezza e cura della persona;Spugne per il corpo
Detergente Intimo Attivo;8,45;7,97;250 ml;Bellezza e cura della persona;Spugne per il corpo
Felce Azzurra Puro Bagnodoccia;3,29;1,74;650 ml;Bellezza e cura della persona;Spugne per il corpo
Chilly, Delicato salviettine intime pocket;2,75;1,79;12 pz;Bellezza e cura della persona;Spugne per il corpo
Winni's Naturel, bagnoschiuma;5,09;3,18;500 ml;Bellezza e cura della persona;Spugne per il corpo
Neutro Roberts, Idratante bagnodoccia;3,55;2,13;700 ml;Bellezza e cura della persona;Spugne per il corpo
Equilibra, aloe detergente intimo;3,06;2,29;200 ml;Bellezza e cura della persona;Spugne per il corpo
Winni's Naturel, sapone liquido mani ecoricarica;4,11;3,03;500 ml;Bellezza e cura della persona;Spugne per il corpo
Neutro Roberts, saponetta idratante;3,49;1,15;100 g;Bellezza e cura della persona;Spugne per il corpo
Dove Go Fresh Bagnodoccia Nutriente Profumo di Tè...;2,69;1,61;500 ml;Bellezza e cura della persona;Spugne per il corpo
Nivea intimo aqua termale Mousse Detergente & Leni...;3,29;1,99;250 ml;Bellezza e cura della persona;Spugne per il corpo
Nivea intimo aqua aloe Mousse Detergente & Idratan...;3,29;1,99;250 ml;Bellezza e cura della persona;Spugne per il corpo
Intima Roberts camomilla delicato;2,75;2,37;200 ml;Bellezza e cura della persona;Spugne per il corpo
Lactacyd, Protezione & Delicatezza detergente inti...;3,06;1,79;300 ml;Bellezza e cura della persona;Spugne per il corpo
Dermon, Dermico doccia schiuma specifico pH 4;;10,45;250 ml;Bellezza e cura della persona;Spugne per il corpo
Adidas, After Sport Hydrating 3in1 gel doccia sha...;;2,99;400 ml;Bellezza e cura della persona;Spugne per il corpo
Saponeria Nesti, Marsiglia Toscano tabacco italian...;;2,57;200 g;Bellezza e cura della persona;Spugne per il corpo
Saponeria Nesti, Marsiglia Toscano pino selvatico...;;2,57;200 g;Bellezza e cura della persona;Spugne per il corpo
Borotalco Talco in polvere busta;1,59;0,64;100 g;Bellezza e cura della persona;Talchi
Felce Azzurra, Classico talco;1,25;0,59;100 g;Bellezza e cura della persona;Talchi
Borotalco, talco in barattolo;;1,89;100 g;Bellezza e cura della persona;Talchi
TALCO BARATTOLO;1,49;1,19;200 g;Bellezza e cura della persona;Talchi
TALCO BUSTA;;0,55;100 g;Bellezza e cura della persona;Talchi
BOROTALCO BARATTOLO;;2,95;200 g;Bellezza e cura della persona;Talchi
Talco Neutro;;1,05;200 g;Bellezza e cura della persona;Talchi
Borotalco Talco in busta;1,19;0,71;100 g;Bellezza e cura della persona;Talchi
Leocrema - Crema Fluida Nutriente, Pelli Secche;3,69;2,00;400 ml;Bellezza e cura della persona;Trattamenti corpo
Acqua alle Rose Antirughe Crema Viso Rassodante Tr...;10,50;7,88;50 ml;Bellezza e cura della persona;Trattamenti corpo
Geomar, Thalasso scrub;10,90;7,25;600 g;Bellezza e cura della persona;Trattamenti corpo
Geomar, Crema-Gel effetto urto;8,90;5,95;200 ml;Bellezza e cura della persona;Trattamenti corpo
Soft Crema Idratante Rinfrescante;4,99;2,39;200 ml;Bellezza e cura della persona;Trattamenti corpo
Nivea sun Doposole hydrate Latte Idratante Lenitiv...;10,29;6,93;200 ml;Bellezza e cura della persona;Trattamenti corpo
Equilibra, Extra Aloe Dermo-gel multiattivo;9,20;8,29;150 ml;Bellezza e cura della persona;Trattamenti corpo
Geomar - Fango d'Alga Oceanica, Contro gli Inestet...;12,50;9,18;650 g;Bellezza e cura della persona;Trattamenti corpo
Crema Corpo Vellutante 48h Siero Idratazione Inten...;4,49;2,00;250 ml;Bellezza e cura della persona;Trattamenti corpo
Nivea Olio satinante corpo pelle molto secca;4,16;3,09;200 ml;Bellezza e cura della persona;Trattamenti corpo
Leocrema Crema fluida idratante pelli normali;2,99;2,00;400 ml;Bellezza e cura della persona;Trattamenti corpo
Leocrema Pellemorbida nutriente multiuso;1,99;1,00;150 ml;Bellezza e cura della persona;Trattamenti corpo
Nivea Sotto la Doccia Balsamo Corpo Nutriente 24h+...;2,90;2,00;250 ml;Bellezza e cura della persona;Trattamenti corpo
Kaloderma nutre fluida corpo Pelle Secca e Molto S...;3,99;2,00;400 ml;Bellezza e cura della persona;Trattamenti corpo
Nivea, Q10 Energy+ latte idratante rassodante pell...;6,19;4,19;250 ml;Bellezza e cura della persona;Trattamenti corpo
Nivea Creme;2,23;1,73;150 ml;Bellezza e cura della persona;Trattamenti corpo
Kaloderma, Nutre olio di mandorle pelle secca e mo...;7,11;6,49;300 ml;Bellezza e cura della persona;Trattamenti corpo
Crema Corpo Nutriente Protettiva;3,26;2,36;200 ml;Bellezza e cura della persona;Trattamenti corpo
Burro Corpo Vellutante Protettivo;5,59;4,19;200 ml;Bellezza e cura della persona;Trattamenti corpo
Nivea sun Protect & bronze Latte Solare con Attiva...;15,60;10,92;200 ml;Bellezza e cura della persona;Trattamenti corpo
Nivea Vital Antirughe crema notte rigenerante pell...;11,00;7,29;50 ml;Bellezza e cura della persona;Trattamenti corpo
Kaloderma Extra Nutrimento Fluida corpo;3,09;2,00;400 ml;Bellezza e cura della persona;Trattamenti corpo
Dove nutriente latte Pelle Secca;4,99;2,99;400 ml;Bellezza e cura della persona;Trattamenti corpo
Rilastil, Rassodante crema corpo;42,50;39,90;200 ml;Bellezza e cura della persona;Trattamenti corpo
Rilastil, Lipofusion fluido;38,00;29,60;250 ml;Bellezza e cura della persona;Trattamenti corpo
Rilastil, Elasticizzante olio;26,50;17,49;80 ml;Bellezza e cura della persona;Trattamenti corpo
Nivea, Soft Crema idratante rinfrescante;4,25;2,55;300 ml;Bellezza e cura della persona;Trattamenti corpo
Nivea, Nutriente corpo pelle secca o molto secca;5,99;3,80;500 ml;Bellezza e cura della persona;Trattamenti corpo
Equilibra, Aloe crema corpo;7,40;6,97;150 ml;Bellezza e cura della persona;Trattamenti corpo
Crema Mani Nutriente Olio di Mandorla;1,45;0,97;30 ml;Bellezza e cura della persona;Trattamenti corpo
Crema Fluida Setificante Tutti i Tipi di Pelle all...;2,90;2,00;400 ml;Bellezza e cura della persona;Trattamenti corpo
Crema Corpo Nutriente 48h Siero Idratazione Intens...;4,49;2,00;250 ml;Bellezza e cura della persona;Trattamenti corpo
Garnier, SkinActive acqua micellare bifase;4,99;2,37;400 ml;Bellezza e cura della persona;Viso
L'Oreal Paris Revitalift Trattamento ricco notte a...;10,29;7,20;50 ml;Bellezza e cura della persona;Viso
Garnier Acqua Micellare Tutto in 1 per Pelli Sensi...;4,59;2,90;400 ml;Bellezza e cura della persona;Viso
L'Oreal Paris Revitalift Trattamento giorno anti-r...;11,90;8,00;50 ml;Bellezza e cura della persona;Viso
Nivea Q10 Plus Antirughe Crema notte;11,50;5,07;50 ml;Bellezza e cura della persona;Viso
Nivea, struccante occhi doppia azione sensibili;3,86;2,02;125 ml;Bellezza e cura della persona;Viso
Crema Super Idratante Prevenzione Rughe Venus;5,59;4,00;50 ml;Bellezza e cura della persona;Viso
L'Oréal Paris Revitalift Filler [HA] Trattamento A...;15,23;11,24;50 ml;Bellezza e cura della persona;Viso
Acqua alle Rose Idratante Crema Viso Rivitalizzant...;10,00;7,12;50 ml;Bellezza e cura della persona;Viso
Venus Acqua Micellare Ultra Delicata - Viso, occhi...;4,99;3,99;400 ml;Bellezza e cura della persona;Viso
Nivea Q10 Plus Antirughe Crema giorno SPF 15, per...;13,00;7,30;50 ml;Bellezza e cura della persona;Viso
Garnier, Skin Naturals Fresh acqua micellare pelli...;3,98;2,90;400 ml;Bellezza e cura della persona;Viso
Garnier Fresh Latte Detergente Idratante per Pelli...;3,59;2,70;200 ml;Bellezza e cura della persona;Viso
LATTE DETERGENTE;3,99;2,79;200 ml;Bellezza e cura della persona;Viso
Equilibra Aloe Crema Viso Anti-Aging;10,45;6,29;50 ml;Bellezza e cura della persona;Viso
Nivea 2in1 latte detergente + tonico tutti i tipi...;3,70;2,37;200 ml;Bellezza e cura della persona;Viso
Venus L'Originale Crema da Giorno Idratante Protet...;3,75;2,00;50 ml;Bellezza e cura della persona;Viso
Labello Classic Care;1,75;0,93;5 ml;Bellezza e cura della persona;Viso
Nivea Salviettine Struccanti 3-in-1 Delicate Pelli...;2,75;2,40;25 pz;Bellezza e cura della persona;Viso
Nivea Q10 Plus Antirughe Crema giorno SPF 15;11,50;7,30;50 ml;Bellezza e cura della persona;Viso
Nivea, acqua micellare extra-delicata pelli sensib...;4,69;2,44;400 ml;Bellezza e cura della persona;Viso
L'Oreal Paris Revitalift Trattamento contorno occh...;12,01;8,90;15 ml;Bellezza e cura della persona;Viso
L'Oreal Paris Revitalift Filler Rivolumizzante con...;16,38;11,55;15 ml;Bellezza e cura della persona;Viso
Nivea, Clean Deeper gel scrub quotidiano;3,99;3,65;150 ml;Bellezza e cura della persona;Viso
Nivea, Clear-up strip zona T pelli normali e miste;5,19;2,80;6 pz;Bellezza e cura della persona;Viso
Garnier, Skin Naturals Fresh struccante occhi deli...;3,04;2,20;125 ml;Bellezza e cura della persona;Viso
L'Oréal Paris Fiori Rari Latte Struccante per Pell...;5,99;4,19;400 ml;Bellezza e cura della persona;Viso
L'Orèal Paris - Struccante, Delicato, Per Occhi -;4,70;3,00;125 ml;Bellezza e cura della persona;Viso
Crema Rosa di Cupra Tubo 75ml;3,70;2,09;75 ml;Bellezza e cura della persona;Viso
Garnier SkinActive Hydra Bomb Maschera Super Idrat...;2,59;2,00;32 g;Bellezza e cura della persona;Viso
equilibra Aloe Crema Viso;6,10;4,55;75 ml;Bellezza e cura della persona;Viso
Labello Soft Rosé;1,89;1,15;4,8 g;Bellezza e cura della persona;Viso
Oral-B Collutorio Denti e Gengive Senza Alcool;3,95;2,09;500 ml;Bellezza e cura della persona;Collutori
Meridol, collutorio;5,52;3,59;400 ml;Bellezza e cura della persona;Collutori
Elmex Sensitive collutorio;4,39;3,95;400 ml;Bellezza e cura della persona;Collutori
Biorepair, collutorio;6,39;5,11;500 ml;Bellezza e cura della persona;Collutori
Elmex, Protezione Carie collutorio;4,67;3,49;400 ml;Bellezza e cura della persona;Collutori
Sensodyne - Collutorio, Cool Mint;5,19;3,02;500 ml;Bellezza e cura della persona;Collutori
Listerine Difesa Denti e Gengive Gusto Delicato;7,09;5,39;600 ml;Bellezza e cura della persona;Collutori
Collutorio Igiene Completa;2,48;1,85;500 ml;Bellezza e cura della persona;Collutori
COLLUTORIO ANTIPLACCA;2,29;1,39;500 ml;Bellezza e cura della persona;Collutori
COLLUTORIO 0,05;8,90;7,95;200 ml;Bellezza e cura della persona;Collutori
COLLUTORIO WHITENING;;1,39;500 ml;Bellezza e cura della persona;Collutori
Listerine, Coolmint collutorio;4,14;3,99;500 ml;Bellezza e cura della persona;Collutori
Oral-B Fluorinse Collutorio;4,39;2,53;500 ml;Bellezza e cura della persona;Collutori
Difesa Denti e Gengive 500 Ml + 95 Ml;5,94;5,19;;Bellezza e cura della persona;Collutori
Colgate Plax Protezione Completa Collutorio;4,20;2,10;500 ml;Bellezza e cura della persona;Collutori
Colgate Plax Soft Mint Collutorio;6,99;6,00;1000 ml;Bellezza e cura della persona;Collutori
Listerine, Difesa Denti e Gengive collutorio menta...;10,99;6,52;1000 ml;Bellezza e cura della persona;Collutori
Gum, Ortho collutorio;5,59;5,34;300 ml;Bellezza e cura della persona;Collutori
COLLUTORIO CPC;4,39;2,99;400 ml;Bellezza e cura della persona;Collutori
Colgate, Plax Soft Mint Collutorio;;6,99;1000 ml;Bellezza e cura della persona;Collutori
COLLUTORIO MOUSSE PERIBIOMA;6,39;5,11;200 ml;Bellezza e cura della persona;Collutori
COLLUTORIO TOTAL CARE;6,95;5,49;500 ml;Bellezza e cura della persona;Collutori
Listerine, Difesa Denti e Gengive collutorio;;5,21;250 ml;Bellezza e cura della persona;Collutori
Dentosan, Linea Specialist trattamento mese collut...;;7,50;200 ml;Bellezza e cura della persona;Collutori
Curasept, ADS 0.12 trattamento prolungato collutor...;;8,90;200 ml;Bellezza e cura della persona;Collutori
Alovex, Protezione Attiva collutorio;;11,90;120 ml;Bellezza e cura della persona;Collutori
Esselunga, Extra whitening collutorio;;1,99;500 ml;Bellezza e cura della persona;Collutori
Esselunga, Extra Protection collutorio;;1,99;500 ml;Bellezza e cura della persona;Collutori
Pasta Capitano Colluttorio White;;2,19;400 ml;Bellezza e cura della persona;Collutori
COLLUTORIO IN GEL SENSIBILITÀ;;3,59;300 ml;Bellezza e cura della persona;Collutori
COLLUTORIO BIO PROTEZ. COMPLETA;;3,15;500 ml;Bellezza e cura della persona;Collutori
COLLUTTORIO SMART RINSE;;4,79;500 ml;Bellezza e cura della persona;Collutori
Mentadent White now;2,99;1,64;75 ml;Bellezza e cura della persona;Dentrifici
Biorepair Fast Sensitive Repair;3,79;2,00;75 ml;Bellezza e cura della persona;Dentrifici
Original;2,99;1,99;75 ml;Bellezza e cura della persona;Dentrifici
Sensodyne Complete Protection Dentifricio Quotidia...;3,79;2,51;75 ml;Bellezza e cura della persona;Dentrifici
Elmex Sensitive Professional Dentifricio;5,39;4,39;75 ml;Bellezza e cura della persona;Dentrifici
Antica Erboristeria Totale;1,49;1,00;75 ml;Bellezza e cura della persona;Dentrifici
AZ Ricerca Dentifricio 3D White Luxe Perfezione;2,99;1,79;75 ml;Bellezza e cura della persona;Dentrifici
Elmex Sensitive Dentifricio;3,23;2,29;75 ml;Bellezza e cura della persona;Dentrifici
Colgate, Total Advanced Whitening dentifricio;3,29;1,19;75 +25 ml;Bellezza e cura della persona;Dentrifici
Parodontax Complete Protection Extra Fresh dentifr...;4,77;3,33;75 ml;Bellezza e cura della persona;Dentrifici
Sensodyne, Rapid Action Whitening dentifricio;4,99;2,99;75 ml;Bellezza e cura della persona;Dentrifici
Marvis Classic strong mint;3,93;1,00;85 ml;Bellezza e cura della persona;Dentrifici
Sensodyne Repair & Protect con Fluoro;4,50;2,70;75 ml;Bellezza e cura della persona;Dentrifici
Iodosan, med dentifricio;3,63;1,99;100 ml;Bellezza e cura della persona;Dentrifici
DENTIFRICIO;3,03;1,00;75 ml;Bellezza e cura della persona;Dentrifici
CREMA DENTIFRICIA;3,35;1,79;50;Bellezza e cura della persona;Dentrifici
Complex / Daily Care;2,99;1,67;75 ml;Bellezza e cura della persona;Dentrifici
Dentifricio Sbiancante;1,46;1,30;125 ml;Bellezza e cura della persona;Dentrifici
Dentifricio Gel Alito Fresco;1,46;1,30;125 ml;Bellezza e cura della persona;Dentrifici
Elmex Protezione Carie Professional Dentifricio;4,73;2,89;75 ml;Bellezza e cura della persona;Dentrifici
Elmex Dentifricio Bimbi Dentifricio;2,68;2,29;50 ml;Bellezza e cura della persona;Dentrifici
Colgate Protection Caries Dentifricio;1,00;0,59;75 ml;Bellezza e cura della persona;Dentrifici
AZ Ricerca Dentifricio Complete+Collutorio Fresche...;1,65;1,50;75 ml;Bellezza e cura della persona;Dentrifici
Aquafresh tripla protezione menta fresca;3,79;0,95;75 ml;Bellezza e cura della persona;Dentrifici
Zendium, Sensitive dentifricio;3,17;2,00;75 ml;Bellezza e cura della persona;Dentrifici
Mentadent, P Prevenzione Completa dentifricio;2,99;2,09;150 ml;Bellezza e cura della persona;Dentrifici
Colgate, Total Original Protection dentifrico;2,55;1,43;75 +25 ml;Bellezza e cura della persona;Dentrifici
Colgate, Max White Expert White dentifricio;4,49;2,35;75 ml;Bellezza e cura della persona;Dentrifici
Parodontax - Dentifricio Quotidiano, con Fluoro;4,49;2,00;75 ml;Bellezza e cura della persona;Dentrifici
DENTIFRICIO PURIFICANTE;5,96;1,00;75 ml;Bellezza e cura della persona;Dentrifici
DENTIFRICIO CARIE GEL;1,59;1,00;75 ml;Bellezza e cura della persona;Dentrifici
Colgate Max White Expert Complete Dentifricio;3,92;2,35;75 ml;Bellezza e cura della persona;Dentrifici
Oral-B, Satin Tape, nastro interdentale menta;3,89;3,07;25 m;Bellezza e cura della persona;Filo interdentale e pulizia
Gum, Soft-Picks Advanced Small Soft-Picks;5,55;5,29;30 pezzi;Bellezza e cura della persona;Filo interdentale e pulizia
Filo Interdentale Cerato Menta 50 m;2,89;1,73;;Bellezza e cura della persona;Filo interdentale e pulizia
Filo Interdentale Cerato;2,39;1,15;50 mt;Bellezza e cura della persona;Filo interdentale e pulizia
Gum, Travel kit dentifricio+spazzolino+filo interd...;5,49;3,95;;Bellezza e cura della persona;Filo interdentale e pulizia
Gum, Expanding Floss 2030 filo interdentale;4,36;2,87;30 m;Bellezza e cura della persona;Filo interdentale e pulizia
Filo Interdentale Super Floss -;4,39;2,39;;Bellezza e cura della persona;Filo interdentale e pulizia
Ultrafloss Filo Interdentale Menta 25 m;2,25;1,23;;Bellezza e cura della persona;Filo interdentale e pulizia
Gum Ortho Floss 3220 Filo Spugnoso Con Parti Rigid...;4,82;4,09;Co...;Bellezza e cura della persona;Filo interdentale e pulizia
Oral-B Pro-Expert Premium Filo Interdentale;;3,29;40 m;Bellezza e cura della persona;Filo interdentale e pulizia
Meridol, filo interdentale spugnoso menta;;3,99;40 m;Bellezza e cura della persona;Filo interdentale e pulizia
Gum, Easy Floss 2000 filo interdentale;;5,49;30 m;Bellezza e cura della persona;Filo interdentale e pulizia
Gum, Soft-Picks advanced regular;;5,55;30 pezzi;Bellezza e cura della persona;Filo interdentale e pulizia
Gum, Ortho Floss 3220 Filo spugnoso con parti rigi...;;5,90;50 pezzi;Bellezza e cura della persona;Filo interdentale e pulizia
Elmex, filo interdentale cerato menta;;3,99;50 m;Bellezza e cura della persona;Filo interdentale e pulizia
Esselunga, filo interdentale cerato al fluoro;;2,39;50 m;Bellezza e cura della persona;Filo interdentale e pulizia
Esselunga, nastro interdentale;;2,74;25 m;Bellezza e cura della persona;Filo interdentale e pulizia
SOFT PICKS ORIGIN.REGUL.SCOVOLINO;4,44;2,49;40 pz;Bellezza e cura della persona;Filo interdentale e pulizia
