Name;Full Price;Current Price;Quantity;Category;Subcategory
Lasagne Alla Bolognese Con Ragù Di Carne E Besciam...;3,19;3,00;600 g;Surgelati e Gelati;Primi Piatti
Lasagne Alla Bolognese Con Ragù Di Carne E Besciam...;2,50;2,00;330 g;Surgelati e Gelati;Primi Piatti
Gnocchi Alla Sorrentina Con Pomodoro, Mozzarella E...;2,36;2,00;550 g;Surgelati e Gelati;Primi Piatti
Cannelloni Con Ricotta E Spinaci Surgelati;3,38;3,00;500 g;Surgelati e Gelati;Primi Piatti
Gnocchetti Con Spinaci Su Ricetta Tirolese;1,69;1,40;350 g;Surgelati e Gelati;Primi Piatti
PAELLA;3,00;2,69;600 g;Surgelati e Gelati;Primi Piatti
CANNELLONI RICOTTA SPINACI;2,49;2,00;500 g;Surgelati e Gelati;Primi Piatti
Findus 4 Salti in Padella Tagliatelle ai Funghi Po...;4,40;3,00;550 g;Surgelati e Gelati;Primi Piatti
4 Salti in Padella Findus - Penne Tricolore;3,99;2,69;550 g;Surgelati e Gelati;Primi Piatti
4 Salti in Padella Findus - Tagliatelle ai Funghi...;5,89;3,49;550 g;Surgelati e Gelati;Primi Piatti
Lasagne alla Bolognese;4,49;2,98;600 g;Surgelati e Gelati;Primi Piatti
Lasagne Vegetali Biologiche Surgelate;3,95;3,60;400 ...;Surgelati e Gelati;Primi Piatti
Pennette Con Salmone E Gamberetti Surgelate;3,19;3,00;550 g;Surgelati e Gelati;Primi Piatti
Senza Glutine Tortellini Al Prosciutto Crudo In Sa...;;3,50;Cru...;Surgelati e Gelati;Primi Piatti
4 Salti in Padella Pappardelle al Ragù di Cinghial...;5,29;4,55;550 g;Surgelati e Gelati;Primi Piatti
4 Salti Le Specialità Bucatini all'amatriciana;5,69;3,98;550 g;Surgelati e Gelati;Primi Piatti
4 Salti in Padella Linguine allo Scoglio;5,29;3,49;550 g;Surgelati e Gelati;Primi Piatti
Findus 4 Salti in Padella Penne Tricolore Pomodoro...;3,05;1,83;550 g;Surgelati e Gelati;Primi Piatti
Findus Chicken Burger;2,99;2,59;227 g;Surgelati e Gelati;Secondi Piatti di Carne
Cotolette Di Pollo Surgelate;2,25;1,99;220 g;Surgelati e Gelati;Secondi Piatti di Carne
Cordon Bleu Con Prosciutto E Formaggio Surgelati;2,59;2,07;250 g;Surgelati e Gelati;Secondi Piatti di Carne
Polpette Pronte Surgelate;4,09;3,99;400 g;Surgelati e Gelati;Secondi Piatti di Carne
Findus - Delizie di Pollo Nuggets;4,99;3,49;250 g;Surgelati e Gelati;Secondi Piatti di Carne
Nuggets;3,39;3,07;250 g;Surgelati e Gelati;Secondi Piatti di Carne
Sadia Premium Bocconcini Tranci Interi 100% Filett...;3,39;3,29;240 g;Surgelati e Gelati;Secondi Piatti di Carne
Sadia Family 6 Cotolette Di Tenero Pollo Agli Spin...;;3,99;...;Surgelati e Gelati;Secondi Piatti di Carne
Aia Cotoletta di Filetti di Pollo;3,29;1,19;280 g;Surgelati e Gelati;Secondi Piatti di Carne
KE PASSIONE KEBAB POLLO;5,49;4,59;300 g;Surgelati e Gelati;Secondi Piatti di Carne
SOTTILISSIME COTOLETTE POLLO;3,59;2,87;280 g;Surgelati e Gelati;Secondi Piatti di Carne
TAGLIATA PETTO DI POLLO;9,49;5,69;700 g;Surgelati e Gelati;Secondi Piatti di Carne
Black Angus, hamburger Black Angus;;4,55;400 g;Surgelati e Gelati;Secondi Piatti di Carne
Aia, Snack Nagghy surgelato;;3,17;300 g;Surgelati e Gelati;Secondi Piatti di Carne
Pescanova, Fishburger impanati e surgelati senza g...;;2,99;200 g;Surgelati e Gelati;Secondi Piatti di Carne
Kioene Burger Agli Spinaci Surgelati;;2,19;150 g;Surgelati e Gelati;Secondi Piatti di Carne
FINDUS STRIPS DI POLLO GR.350;5,99;4,79;350 g;Surgelati e Gelati;Secondi Piatti di Carne
ALETTE DI POLLO;4,79;4,49;500 g;Surgelati e Gelati;Secondi Piatti di Carne
SPEEDY POLLO THE ORIGINAL;2,59;1,65;300 g;Surgelati e Gelati;Secondi Piatti di Carne
10 Hamburger Surgelati con Proteine di Soia 10 x 7...;;3,79;750 g;Surgelati e Gelati;Secondi Piatti di Carne
Nuggets di Pollo;;1,00;180 g;Surgelati e Gelati;Secondi Piatti di Carne
Pollo del Contadino;;4,49;1300 g;Surgelati e Gelati;Secondi Piatti di Carne
Polpettine di Bovino;;2,99;500 g;Surgelati e Gelati;Secondi Piatti di Carne
Speedy Pollo;2,69;2,19;300 g;Surgelati e Gelati;Secondi Piatti di Carne
10 Hamburger di Bovino;;3,69;750 g;Surgelati e Gelati;Secondi Piatti di Carne
NAGGHY DI POLLO;2,69;1,44;300 g;Surgelati e Gelati;Secondi Piatti di Carne
CORDON BLEU DI POLLO;5,49;4,39;480 g;Surgelati e Gelati;Secondi Piatti di Carne
KEBAB DI POLLO CON VERDURE;;5,30;450 g;Surgelati e Gelati;Secondi Piatti di Carne
Montana, Leggeri hamburger surgelati;;4,33;400 g;Surgelati e Gelati;Secondi Piatti di Carne
AIA Durango alette di pollo cotte arrosto;5,09;2,39;600 g;Surgelati e Gelati;Secondi Piatti di Carne
Asian Rice con Filetto di Pollo;;3,99;500 g;Surgelati e Gelati;Secondi Piatti di Carne
Brasato con Polenta;;3,99;300 g;Surgelati e Gelati;Secondi Piatti di Carne
Findus Platessa alla Mugnaia;7,99;3,32;250 g;Surgelati e Gelati;Secondi Piatti di Pesce
Arbi CondiScampi;6,75;3,29;300 g;Surgelati e Gelati;Secondi Piatti di Pesce
Capitan Findus 2 Fish & Chips Burger;4,29;2,35;227 g;Surgelati e Gelati;Secondi Piatti di Pesce
Findus I Gratinati Salmone con Melanzane e Pomodor...;6,59;5,45;280 g;Surgelati e Gelati;Secondi Piatti di Pesce
Findus I Gratinati Merluzzo d'Alaska con Erbe Medi...;6,59;2,95;380 g;Surgelati e Gelati;Secondi Piatti di Pesce
Esca I Condipresto Pronto Scoglio;5,19;3,50;450 g;Surgelati e Gelati;Secondi Piatti di Pesce
Findus Filetti di Platessa impanati;5,09;3,49;275 g;Surgelati e Gelati;Secondi Piatti di Pesce
Merluzzo Gratinato con Rosmarino e Limone;4,99;2,99;360 g;Surgelati e Gelati;Secondi Piatti di Pesce
Findus 2 Burger di Merluzzo con prezzemolo e limon...;4,69;3,79;170 g;Surgelati e Gelati;Secondi Piatti di Pesce
Findus 2 Burger di Salmone con limone e aneto;5,29;3,49;170 g;Surgelati e Gelati;Secondi Piatti di Pesce
Esca i Condipresto Voglia di Gamberi;5,49;3,52;400 g;Surgelati e Gelati;Secondi Piatti di Pesce
Capitan Findus Filetti di Platessa impanati;6,49;4,35;250 g;Surgelati e Gelati;Secondi Piatti di Pesce
Esselunga, Bastoncini filetti di merluzzo impanati...;3,79;2,19;450 g;Surgelati e Gelati;Secondi Piatti di Pesce
Esselunga, Bastoncini filetti di merluzzo impanati...;2,59;1,87;300 g;Surgelati e Gelati;Secondi Piatti di Pesce
Capitan Findus Croccole senza Glutine;4,99;3,69;250 g;Surgelati e Gelati;Secondi Piatti di Pesce
Montana 4 Hamburger con bacon surgelati;4,69;2,89;400 g;Surgelati e Gelati;Secondi Piatti di Pesce
Findus 2 Fiori di Salmone;5,99;3,54;200 g;Surgelati e Gelati;Secondi Piatti di Pesce
Findus I Gratinati Merluzzo d'Alaska con Patate e...;6,59;4,58;380 g;Surgelati e Gelati;Secondi Piatti di Pesce
Arbi Sugo Pronto Astice e Pomodorini;4,49;3,90;220 g;Surgelati e Gelati;Secondi Piatti di Pesce
Esca i Condipresto ortomare;5,19;4,05;400 g;Surgelati e Gelati;Secondi Piatti di Pesce
POLPETTE DI PESCE NORVEGIA;4,95;2,49;240 g;Surgelati e Gelati;Secondi Piatti di Pesce
Pescanova, merluzzo panato surgelato;;5,29;340 g;Surgelati e Gelati;Secondi Piatti di Pesce
Filetti Gustosi di Merluzzo con Patate e Pomodori;4,89;2,99;320 g;Surgelati e Gelati;Secondi Piatti di Pesce
Filetti di Merluzzo con Zucchine e Capperi;4,99;3,49;320 g;Surgelati e Gelati;Secondi Piatti di Pesce
I Condipresto Pronto Scoglio al Pomodoro;5,51;3,55;450 g;Surgelati e Gelati;Secondi Piatti di Pesce
Filetti Di Platessa Impanati, Prefritti E Surgelat...;3,99;3,49;Sur...;Surgelati e Gelati;Secondi Piatti di Pesce
4 Croccanti Di Filetti Di Merluzzo Impanati E Surg...;3,15;2,94;Impanat...;Surgelati e Gelati;Secondi Piatti di Pesce
Orata Alla Ligure Surgelata;4,25;3,99;250 g;Surgelati e Gelati;Secondi Piatti di Pesce
Merluzzo Alla Mediterranea Surgelato;4,25;3,99;25 ...;Surgelati e Gelati;Secondi Piatti di Pesce
Branzino In Salsa Di Senape Surgelato;4,25;3,99;250 ...;Surgelati e Gelati;Secondi Piatti di Pesce
Totani Con Patate Surgelati;3,90;3,59;450 g;Surgelati e Gelati;Secondi Piatti di Pesce
FILETTI DI PLATESSA ALLA MUGNAIA;4,99;2,79;300 g;Surgelati e Gelati;Secondi Piatti di Pesce
Wurstel e Patatine Surgelata;2,69;1,99;240 g;Surgelati e Gelati;Pizza
Funghi Finferli;7,95;1,00;215 g;Surgelati e Gelati;Pizza
Cameo Pizza Ristorante Salame;3,89;2,00;320 g;Surgelati e Gelati;Pizza
PIZZA MARGHERITA;4,89;2,19;485 g;Surgelati e Gelati;Pizza
Cameo, Big Americans Supreme pizza surgelata;5,34;1,74;450 g;Surgelati e Gelati;Pizza
Buitoni, pizza alla Seconda Salame surgelata;5,69;3,79;630 g;Surgelati e Gelati;Pizza
Forno di Pietra Pizza Prosciutto e Formaggio Pizza...;2,49;2,00;340 g;Surgelati e Gelati;Pizza
BUITONI BELLA NAPOLI 4 FORMAGGI Pizza surgelata;4,79;2,39;425 g;Surgelati e Gelati;Pizza
BUITONI BELLA NAPOLI PROSCIUTTO E FUNGHI Pizza sur...;4,79;2,39;415 g;Surgelati e Gelati;Pizza
Pizza Di Grano Kamut Alle Verdure Grigliate Biolog...;3,50;2,62;380 g;Surgelati e Gelati;Pizza
Pizza Con Mozzarella Di Bufala Campana Surgelata;;3,28;Campana”...;Surgelati e Gelati;Pizza
Pizza Bianca Rustica Con Patate, Funghi E Spinaci...;3,15;2,00;400 g;Surgelati e Gelati;Pizza
"Pizza ""speck Alto Adige I.g.p."" E Funghi Con ""prov...";3,15;2,00;390 g;Surgelati e Gelati;Pizza
Pizza Ai 4 Formaggi Con Mozzarella, Gorgonzola Dop...;2,15;2,00;340 g;Surgelati e Gelati;Pizza
Mamamia Pizza Margherita 2+1;5,39;3,10;900 g;Surgelati e Gelati;Pizza
Pizza Di Grano Kamut Margherita Biologica Surgelat...;3,10;2,32;340 g;Surgelati e Gelati;Pizza
Trancio Di Pizza Margherita Surgelato 1 Pizza;1,89;1,00;400 g;Surgelati e Gelati;Pizza
4 Pizzette Margherita Surgelate;2,08;2,00;360 g;Surgelati e Gelati;Pizza
2 Pizze Margherita Con Mozzarella Surgelate;3,00;2,94;660 g;Surgelati e Gelati;Pizza
PIZZA MARGHERITA;2,99;1,69;400 g;Surgelati e Gelati;Pizza
Cameo Pizza Ristorante Tonno;2,59;1,65;355 g;Surgelati e Gelati;Pizza
Roncadin Pizza Margherita Vegana;3,99;3,49;377 g;Surgelati e Gelati;Pizza
Rucola e Pomodorini;1,99;1,00;225 g;Surgelati e Gelati;Pizza
Pizza surgelata (1 pizza);2,99;2,15;360 g;Surgelati e Gelati;Pizza
BELLA NAPOLI RICOTTA DI BUFALA CAMPANA DOP E POMOD...;3,59;2,31;425 g;Surgelati e Gelati;Pizza
Pizza Al Tonno Surgelata;2,25;2,15;370 g;Surgelati e Gelati;Pizza
Pizza Alla Pala Margherita;2,18;1,89;200 g;Surgelati e Gelati;Pizza
Cameo Speedypizza Margherita;2,78;1,63;200 g;Surgelati e Gelati;Pizza
PIZZA RISTORANTE VERDURE GRIGL.;2,79;1,65;365 g;Surgelati e Gelati;Pizza
cameo Ristorante Pesto Sfizioso;2,39;2,00;335 g;Surgelati e Gelati;Pizza
BUITONI PIZZA RICCA MARGHERITA SFIZIOSA Pizza surg...;2,39;1,39;320 g;Surgelati e Gelati;Pizza
BUITONI BELLA NAPOLI STRACCHINO E VERDURE Pizza su...;2,99;2,15;355 g;Surgelati e Gelati;Pizza
Focaccia Al Formaggio Surgelata;4,49;3,36;300 g;Surgelati e Gelati;Torte e Basi Salate
Erbazzone Reggiano Torta Rustica Surgelato;3,99;2,99;Surgela...;Surgelati e Gelati;Torte e Basi Salate
Focaccia Farcita Con Prosciutto Cotto E Formaggi S...;;3,49;F...;Surgelati e Gelati;Torte e Basi Salate
PASTA FROLLA;2,35;1,69;500 g;Surgelati e Gelati;Torte e Basi Salate
Schär Millefoglie Pasta sfoglia;3,75;2,25;250 g;Surgelati e Gelati;Torte e Basi Salate
Vol Au Vent Pronti da Riempire;;1,99;250 g;Surgelati e Gelati;Torte e Basi Salate
Salatini di Pasta Sfoglia Mignon Misti;;1,99;250 g;Surgelati e Gelati;Torte e Basi Salate
Torta Salata Spinaci Ricotta;1,89;1,59;300 g;Surgelati e Gelati;Torte e Basi Salate
Torta Salata Patate Prosciutto e Mozzarella;;1,89;300 g;Surgelati e Gelati;Torte e Basi Salate
Torta Pasqualina Cotta al Forno Gusto Qui;3,87;1,26;300 g;Surgelati e Gelati;Torte e Basi Salate
Torta di Zucchine Cotta al Forno 250 g;3,39;0,78;263 g;Surgelati e Gelati;Torte e Basi Salate
Base per Focaccia Salata;;1,29;385 g;Surgelati e Gelati;Torte e Basi Salate
Focaccia Prosciutto Cotto e Provola Affumicata;;2,69;390 g;Surgelati e Gelati;Torte e Basi Salate
Pasta Sfoglia Surgelata 2 Rotoli Già Stesi;;1,69;5 ...;Surgelati e Gelati;Torte e Basi Salate
Torta Verde;;2,99;250 g;Surgelati e Gelati;Torte e Basi Salate
Focaccia con Stracchino;;4,45;150 g;Surgelati e Gelati;Torte e Basi Salate
Saltimbocca;;1,99;230 g;Surgelati e Gelati;Torte e Basi Salate
Panuozzo;;2,99;450 g;Surgelati e Gelati;Torte e Basi Salate
Farcipizza;;2,99;450000 g;Surgelati e Gelati;Torte e Basi Salate
Bruschettoni;;2,99;450 g;Surgelati e Gelati;Torte e Basi Salate
Specialità del Territorio Erbazzone Reggiano Torta...;;4,10;500 g;Surgelati e Gelati;Torte e Basi Salate
Salatini Misti Snack Surgelati;;3,49;500 g;Surgelati e Gelati;Torte e Basi Salate
Focaccia con Prosciutto e Provola Affumicata;;2,69;390 g;Surgelati e Gelati;Torte e Basi Salate
Focaccia alla Toscana;;2,19;660 g;Surgelati e Gelati;Torte e Basi Salate
Torta alle Verdure 250 g;;3,23;250 g;Surgelati e Gelati;Torte e Basi Salate
Torta al Prosciutto Cotta al Forno 250 g;3,39;0,78;263 g;Surgelati e Gelati;Torte e Basi Salate
Torta Ricotta e Spinaci 250 g;3,73;0,73;250 g;Surgelati e Gelati;Torte e Basi Salate
Girelle di Ricotta e Spinaci con Besciamella Surge...;;3,80;560 g;Surgelati e Gelati;Torte e Basi Salate
Orogel Carote a Fette Surgelati;1,99;1,35;400 g;Surgelati e Gelati;Altre Verdure
Findus Pisellini Primavera;3,99;1,99;700 g;Surgelati e Gelati;Altre Verdure
Orogel Il Benessere Verdurì verdure scelte surgela...;3,49;1,12;600 g;Surgelati e Gelati;Altre Verdure
CAVOLFIORE ROSETTE;2,25;1,89;450 g;Surgelati e Gelati;Altre Verdure
LA VALLE DEGLI ORTI I CUORI DI CARCIOFO carciofi s...;3,19;2,14;300 g;Surgelati e Gelati;Altre Verdure
Findus, minestrone tradizione - Il Passato;2,99;2,09;600 g;Surgelati e Gelati;Altre Verdure
McCain La Patatine Originali;2,15;1,18;1000 g;Surgelati e Gelati;Altre Verdure
Pizzoli Topolino le Croccomagie;2,49;1,37;600 g;Surgelati e Gelati;Altre Verdure
Bonduelle Natura in Padella Fagiolini e patate;1,99;1,34;450 g;Surgelati e Gelati;Altre Verdure
Findus Minestrone Tradizione 5 minuti IGP;3,39;2,69;600 g;Surgelati e Gelati;Altre Verdure
FAGIOLINI FINI;2,45;1,59;1000 g;Surgelati e Gelati;Altre Verdure
Orogel Cimette di Rapa Surgelati;3,99;2,25;450 g;Surgelati e Gelati;Altre Verdure
Orogel, Contorno Fantasia surgelato;3,29;1,99;450 g;Surgelati e Gelati;Altre Verdure
Orogel, La Cucina Italiana Tris Grigliato gusto ri...;3,89;1,94;400 g;Surgelati e Gelati;Altre Verdure
Findus Zuppa Tradizionale con Avena Integrale;3,09;2,00;500 g;Surgelati e Gelati;Altre Verdure
Orogel Zucca a Cubetti Surgelati;2,59;2,29;450 g;Surgelati e Gelati;Altre Verdure
Broccoli rosette;3,48;1,18;450 g;Surgelati e Gelati;Altre Verdure
Bonduelle Coccole 8 tortini di broccoli e carote;3,29;1,89;300 g;Surgelati e Gelati;Altre Verdure
Bonduelle, Delizia di spinaci surgelati;3,19;2,19;400 g;Surgelati e Gelati;Altre Verdure
Cavolfiore;1,99;1,00;600 g;Surgelati e Gelati;Altre Verdure
Orogel il Benessere Verdurì 5 Cereali Surgelati;3,69;2,55;600 g;Surgelati e Gelati;Altre Verdure
Findus Fagiolini primavera;2,64;2,39;450 g;Surgelati e Gelati;Altre Verdure
Orogel Il Benessere Soia Edamame Surgelati;2,99;1,92;330 g;Surgelati e Gelati;Altre Verdure
ZUCCHINE A FETTE;1,89;1,39;450 g;Surgelati e Gelati;Altre Verdure
LE MERAVIGLIE TORTINO DI VERDURE;2,88;1,44;240 g;Surgelati e Gelati;Altre Verdure
LE MERAVIGLIE TORTINO DI SPINACI;2,88;1,44;240 g;Surgelati e Gelati;Altre Verdure
CREMOSA PISELLI E ZUCCHINE S/G;3,79;2,24;600 g;Surgelati e Gelati;Altre Verdure
Fave Sgranate Surgelati;2,95;2,89;450 g;Surgelati e Gelati;Altre Verdure
Borlotti Fagioli Surgelati;2,39;1,49;450 g;Surgelati e Gelati;Altre Verdure
Fagiolini Finissimi;1,57;0,99;600 g;Surgelati e Gelati;Altre Verdure
4 Salti in Padella Findus - Spinaci Filanti;4,59;2,49;450 g;Surgelati e Gelati;Altre Verdure
Polpettine Di Soia Con Verdure Grigliate Biologich...;3,90;2,92;300 g;Surgelati e Gelati;Altre Verdure
Chef Gourmet;3,35;2,00;500 g;Surgelati e Gelati;Aromi
Prezzemolo Tritato E Surgelato;0,68;0,65;50 g;Surgelati e Gelati;Aromi
Misto Per Soffritto Tritato E Surgelato;0,75;0,68;15 ...;Surgelati e Gelati;Aromi
Cipolla Tritata E Surgelata;0,89;0,68;150 g;Surgelati e Gelati;Aromi
Basilico Tritato E Surgelato;0,75;0,68;50 g;Surgelati e Gelati;Aromi
Orogel Misto per Soffritto Surgelato;1,94;1,85;300 g;Surgelati e Gelati;Aromi
Orogel, Le Erbe Aromatiche prezzemolo e aglio surg...;1,30;1,00;100 g;Surgelati e Gelati;Aromi
Orogel, Le Erbe Aromatiche aglio surgelato;1,36;1,25;100 g;Surgelati e Gelati;Aromi
Orogel Le Erbe Aromatiche Scalogno surgelato;1,10;1,09;100 g;Surgelati e Gelati;Aromi
Prezzemolo Tritato;0,75;0,69;50 g;Surgelati e Gelati;Aromi
Esselunga Bio, scalogno tritato surgelato biologic...;;1,15;100 g;Surgelati e Gelati;Aromi
Esselunga Bio, prezzemolo e aglio tritati biologic...;;1,49;100 g;Surgelati e Gelati;Aromi
Esselunga Bio, misto per soffritto biologico surge...;;1,75;300 g;Surgelati e Gelati;Aromi
Esselunga Bio, aglio tritato biologico surgelato;;1,49;75 g;Surgelati e Gelati;Aromi
Esselunga Bio, cipolla rossa tritata surgelata bio...;;1,15;100 g;Surgelati e Gelati;Aromi
Come una volta, tris grigliato surgelato;;2,85;600 g;Surgelati e Gelati;Aromi
Esselunga, zucca a cubetti surgelata;;2,49;750 g;Surgelati e Gelati;Aromi
VIRTU' DI BRODO LEGGEREZZA;;0,99;200 g;Surgelati e Gelati;Aromi
Esselunga Bio, prezzemolo tritato biologico surgel...;;1,15;50 g;Surgelati e Gelati;Aromi
Esselunga Bio, misto per soffritto biologico surge...;;1,15;150 g;Surgelati e Gelati;Aromi
Esselunga Bio, cipolla tritata biologica surgelata;;1,15;150 g;Surgelati e Gelati;Aromi
Esselunga Bio, basilico tritato biologico surgelat...;;1,15;50 g;Surgelati e Gelati;Aromi
MISTO PER SOFFRITTO;;0,99;300 g;Surgelati e Gelati;Aromi
CIPOLLA ROSSA DI TROPEA;1,89;1,70;100 g;Surgelati e Gelati;Aromi
Aglio Tritato;;1,39;100 g;Surgelati e Gelati;Aromi
Basilico Tritato;;0,69;50 g;Surgelati e Gelati;Aromi
Cipolla Tritata;;0,59;100 g;Surgelati e Gelati;Aromi
CIPOLLA CON DOSATORE;;0,79;150 g;Surgelati e Gelati;Aromi
VIRTU' DI BRODO;;1,55;200 g;Surgelati e Gelati;Aromi
SCALOGNO;1,29;0,89;100 g;Surgelati e Gelati;Aromi
PREZZEMOLO CON DOSATORE;;0,89;50 g;Surgelati e Gelati;Aromi
MISTO SOFFRITTO;;0,79;150 g;Surgelati e Gelati;Aromi
Funghi Champignon A Fette Surgelati;1,95;1,67;450 g;Surgelati e Gelati;Funghi
Bontà Di Funghi Già Puliti E Tagliati Surgelati;2,50;1,56;Surgel...;Surgelati e Gelati;Funghi
Scherini, funghi porcini cubetti surgelati;5,89;2,49;300 g;Surgelati e Gelati;Funghi
Funghi Porcini;3,49;1,49;80 g;Surgelati e Gelati;Funghi
MISTO FUNGHI CON PORCINI;2,90;1,59;300 g;Surgelati e Gelati;Funghi
Scherini, funghi porcini (Boletus edulis e gruppo)...;;9,19;300 g;Surgelati e Gelati;Funghi
Sartor, porcini cubi surgelati;;4,49;300 g;Surgelati e Gelati;Funghi
Valtaro, Sottozero funghi porcini a fette surgelat...;;7,55;300 g;Surgelati e Gelati;Funghi
Esselunga, misto funghi trifolati surgelato;;3,75;300 g;Surgelati e Gelati;Funghi
Esselunga, funghi champignons surgelati;2,45;1,71;450 g;Surgelati e Gelati;Funghi
Esselunga, contorno misto funghi con porcini surge...;;2,65;300 g;Surgelati e Gelati;Funghi
Misto Funghi con Porcini;;6,99;1000 g;Surgelati e Gelati;Funghi
Funghi Champignon;2,99;1,99;1000 g;Surgelati e Gelati;Funghi
Misto Funghi Congelati;;2,99;290 g;Surgelati e Gelati;Funghi
Porcini a Cubi Congelati;;4,19;300 g;Surgelati e Gelati;Funghi
Funghi Porcini Interi;8,39;6,71;300 g;Surgelati e Gelati;Funghi
Funghi Misti;2,39;1,89;450 g;Surgelati e Gelati;Funghi
Funghi Champignon;;1,69;600 g;Surgelati e Gelati;Funghi
MISTO FUNGHI TRIFOLATI;;2,99;300 g;Surgelati e Gelati;Funghi
FUNGHI CHAMPIGNON FETTE EXTRA;;1,49;450 g;Surgelati e Gelati;Funghi
Porcini a Fette Congelati;;4,50;300 g;Surgelati e Gelati;Funghi
Funghi Champignons Tagliati a Fette;1,29;1,19;450 g;Surgelati e Gelati;Funghi
Misto Funghi con Porcini;;1,59;300 g;Surgelati e Gelati;Funghi
Gourmet Vellutata di Funghi Porcini Surgelato;;3,50;550 g;Surgelati e Gelati;Funghi
I Gusti del Bosco Funghi Champignon Congelati;;2,69;1000 g;Surgelati e Gelati;Funghi
Premium Funghi Porcini a Fette Congelati;;6,99;300 g;Surgelati e Gelati;Funghi
Funghi;;3,99;750 g;Surgelati e Gelati;Funghi
Il Bosco dei Sapori Funghi Porcini Secchi Commerci...;;3,10;50 g;Surgelati e Gelati;Funghi
Funghi Porcini a Fette Surgelati;8,59;6,87;300 g;Surgelati e Gelati;Funghi
Findus Minestrone Tradizione IGP;1,99;1,49;400 g;Surgelati e Gelati;Minestroni e Zuppe
Findus Minestrone Leggero;3,34;1,78;700 g;Surgelati e Gelati;Minestroni e Zuppe
Findus Cremosa Zucca e Carote;4,69;2,24;600 g;Surgelati e Gelati;Minestroni e Zuppe
Orogel Il Benessere Virtù di Zuppa Leggerezza Surg...;2,59;1,29;500 g;Surgelati e Gelati;Minestroni e Zuppe
Findus Minestrone Leggeramente Sapori Orientali;2,99;2,09;600 g;Surgelati e Gelati;Minestroni e Zuppe
ZUPPA DI LEGUMI E CEREALI;2,35;1,49;600 g;Surgelati e Gelati;Minestroni e Zuppe
MINESTRONE DI VERDURE;1,90;1,49;1000 g;Surgelati e Gelati;Minestroni e Zuppe
Findus - Minestrone Tradizione;3,32;1,99;1000 g;Surgelati e Gelati;Minestroni e Zuppe
Findus Zuppa di Farro e Ceci con Grano Saraceno;2,49;2,00;500 g;Surgelati e Gelati;Minestroni e Zuppe
ZUPPA ORTOLANA;3,42;2,35;620 g;Surgelati e Gelati;Minestroni e Zuppe
Findus Minestrone Tradizione;3,15;1,57;1000 g;Surgelati e Gelati;Minestroni e Zuppe
Findus, Minestrone Leggeramente Bontà di Semi surg...;2,99;2,95;600 g;Surgelati e Gelati;Minestroni e Zuppe
BUON MINESTRONE;2,79;1,19;750 g;Surgelati e Gelati;Minestroni e Zuppe
La Valle degli Orti Minestrone Classico;2,99;1,49;850 g;Surgelati e Gelati;Minestroni e Zuppe
La Valle degli Orti Minestrone Classico;2,06;1,19;400 g;Surgelati e Gelati;Minestroni e Zuppe
Zuppa Rustica Con Legumi E Cereali Surgelata;1,98;1,00;600 g;Surgelati e Gelati;Minestroni e Zuppe
Zuppa Di Verdure Con Orzo, Farro E Avena Surgelata;1,98;1,00;600 g;Surgelati e Gelati;Minestroni e Zuppe
Minestrone Di Verdure Surgelate Biologico;1,65;1,59;Biologic...;Surgelati e Gelati;Minestroni e Zuppe
Minestrone Di Verdure Surgelato;1,25;0,99;450 g;Surgelati e Gelati;Minestroni e Zuppe
MINESTRONE CLASSICO;1,69;0,84;450 g;Surgelati e Gelati;Minestroni e Zuppe
MINESTRONE RICCO CON LEGUMI;3,30;2,75;750 g;Surgelati e Gelati;Minestroni e Zuppe
Orogel, Il Benessere Leggerezza Verdurì surgelato;3,59;2,64;800 g;Surgelati e Gelati;Minestroni e Zuppe
Findus Legumissimi-Mix Legumi al Naturale-Fagioli...;2,49;2,42;425 g;Surgelati e Gelati;Minestroni e Zuppe
MINESTRONE RICCO DI LEGUMI;1,49;0,50;600 g;Surgelati e Gelati;Minestroni e Zuppe
Findus Zuppa Saporita con Basilico Genovese DOP;3,09;2,99;500 g;Surgelati e Gelati;Minestroni e Zuppe
ZUPPA TOSCANA AL FARRO;2,95;1,29;450 g;Surgelati e Gelati;Minestroni e Zuppe
Orogel, Il Benessere virtù di zuppa ceci e lenticc...;3,80;1,90;500 g;Surgelati e Gelati;Minestroni e Zuppe
Orogel, Il Benessere virtù di brodo vegetale surge...;1,85;0,92;200 g;Surgelati e Gelati;Minestroni e Zuppe
Smart, minestrone surgelato;;1,98;1,5 kg;Surgelati e Gelati;Minestroni e Zuppe
Sartor, Gran minestrone di riso e verdure surgelat...;;3,19;600 g;Surgelati e Gelati;Minestroni e Zuppe
Findus, minestrone tradizione IGP surgelato;;3,85;1,1 kg;Surgelati e Gelati;Minestroni e Zuppe
MINESTRONETRADIZIONECON LEGUMI;3,19;2,55;600 g;Surgelati e Gelati;Minestroni e Zuppe
McCain Mediterranean Potatoes;3,59;1,99;750 g;Surgelati e Gelati;Patate
McCain Kid Smile;3,69;1,29;650 g;Surgelati e Gelati;Patate
McCain, Golden Long surgelati;3,49;1,00;750 g;Surgelati e Gelati;Patate
Findus 4 Salti in Padella Patate Saporite;4,50;2,00;450 g;Surgelati e Gelati;Patate
Findus Pat Bon Le Classiche;1,99;1,59;450 g;Surgelati e Gelati;Patate
McCain Purè al Naturale;2,59;1,54;750 g;Surgelati e Gelati;Patate
Pizzoli Viva le Patatine!;2,15;0,81;750 g;Surgelati e Gelati;Patate
Patate Prefritte Da Forno Surgelate;1,46;0,99;1000 g;Surgelati e Gelati;Patate
Pizzoli, Pata Snella Barchette surgelate;2,49;1,60;600 g;Surgelati e Gelati;Patate
McCain Forno Chips;2,49;1,29;600 g;Surgelati e Gelati;Patate
Crocchette Di Patate Prefritte Surgelate;1,87;1,79;6 ...;Surgelati e Gelati;Patate
Patate A Fette Grigliate Surgelate Biologiche;2,10;1,00;450 g;Surgelati e Gelati;Patate
Patate Novelle Surgelate;1,88;1,00;600 g;Surgelati e Gelati;Patate
Patate Da Friggere Surgelate;1,20;1,00;750 g;Surgelati e Gelati;Patate
Pizzoli - Pata Snella, Patatine;1,24;1,00;750 g;Surgelati e Gelati;Patate
LE PATATINE ORIGINALI;2,89;2,35;1000 g;Surgelati e Gelati;Patate
Patatine Prefritte Surgelate Prezzo Ok;;1,09;1000 g;Surgelati e Gelati;Patate
Patate Rustiche Surgelate;1,35;1,00;600 g;Surgelati e Gelati;Patate
PATATE ORIGINAL STYLE;2,99;2,89;500 g;Surgelati e Gelati;Patate
Findus Le Classiche;3,49;3,45;1000 g;Surgelati e Gelati;Patate
TOCCHETTI S/G;2,99;1,99;600 g;Surgelati e Gelati;Patate
PAT BON LE CLASSICHE S/G;2,99;2,49;900 g;Surgelati e Gelati;Patate
Esselunga, patate tonde da forno prefritte e surge...;;2,35;600 g;Surgelati e Gelati;Patate
Come una volta, Patate Grigliate con buccia surgel...;;3,79;450 g;Surgelati e Gelati;Patate
Esselunga Bio, patate biologiche surgelate;;2,99;750 g;Surgelati e Gelati;Patate
PATASNELLA ULTRA VELOCI S/G;2,59;1,49;500 g;Surgelati e Gelati;Patate
Esselunga, patate da forno prefritte e surgelate;;2,09;750 g;Surgelati e Gelati;Patate
Esselunga, patate rustiche con rosmarino surgelate;;2,39;450 g;Surgelati e Gelati;Patate
Esselunga, patate fritte surgelate;;2,39;1000 g;Surgelati e Gelati;Patate
Esselunga, crocchette di patate surgelate;;2,25;600 g;Surgelati e Gelati;Patate
PATATE AL FORNO COUNTRY;2,49;1,24;650 g;Surgelati e Gelati;Patate
PATATE IGP A SPICCHI CON BUCCIA;;1,79;450 g;Surgelati e Gelati;Patate
Findus Piselli Novelli;4,99;2,49;1000 g;Surgelati e Gelati;Piselli e Fagiolini
Findus Ciuffetti di Spinaci Primavera;2,99;2,49;800 g;Surgelati e Gelati;Piselli e Fagiolini
Findus Pisellini Primavera;3,99;1,95;450 g;Surgelati e Gelati;Piselli e Fagiolini
PISELLI FINISSIMI;1,20;0,99;450 g;Surgelati e Gelati;Piselli e Fagiolini
PISELLI FINI;1,99;1,49;1000 g;Surgelati e Gelati;Piselli e Fagiolini
Piselli Fini Surgelati Biologici;1,86;1,50;450 g;Surgelati e Gelati;Piselli e Fagiolini
Piselli Novelli Surgelati;2,29;2,19;1000 g;Surgelati e Gelati;Piselli e Fagiolini
Piselli Finissimi Surgelati;1,98;1,58;750 g;Surgelati e Gelati;Piselli e Fagiolini
